user,created_at,text
ANCALERTS,2020-01-29 01:30:00+00:00,"Japan, US evacuees leave Chinese virus epicenter as toll spikes http://bit.ly/2t9WonQ #nCoV #coronavirus"
Sajansga,2020-01-29 01:24:20+00:00,Get checked up since the new Chinese virus is in threat of spread
Mark____Edwards,2020-01-29 01:22:31+00:00,"Trump ally Michael Savage on coronavirus: Send things from the “Chinese virus market"" to Rep. Alexandria Ocasio-Cortez "
weijiasun84,2020-01-29 01:22:14+00:00,"Ashley, your article calling the Coronavirus ""Chinese Virus"" is full of racism &amp; not acceptable in Australia. Do you dare to call the Ebola virus ""Black Virus""? ""PANDAmonium""? Shame on you for the cheap joke while innocent people are suffering. #Fakenews journalism."
marybodnar1,2020-01-29 01:14:24+00:00,"Actually, with my luck, I’d probably have a better chance of contacting the Chinese virus!! Lol!!"
BuckmanJeannie,2020-01-29 01:13:09+00:00,Health Matters Chinese Virus | Watch News Videos Online 
samted25,2020-01-29 01:11:06+00:00,"“So, on the menu at Chinese virus market: rats, live wolf pups. Isn’t that nice? Send that to occasional cortex (Ocasio-Cortez) the next time she bashes America,” ...and what exactly would this mean?"
ChannelNewsAsia,2020-01-29 01:09:05+00:00,"Japan, US evacuees leave Chinese virus epicentre as toll spikes https://cna.asia/2O84bJV"
GinnCatherine,2020-01-29 00:54:01+00:00,New Israeli Masks Could Help Stop Deadly Chinese Virus 
draintheswamp55,2020-01-29 00:53:10+00:00,“The Chinese virus is spreading”—deception and false news « Jon Rappoport's Blog https://blog.nomorefakenews.com/2020/01/27/the-chinese-virus-is-spreading-deception-and-false-news/
jon2775,2020-01-29 00:51:29+00:00,“The Chinese virus is spreading”—deception and false news 
wallydebling,2020-01-29 00:47:25+00:00,"Confirmed Chinese #Virus carriers doubles in 24 hrs &amp; #HealthCanada advising Canadians not to panic, wash your hands often, ""Don't worry be happy""...."
VestSSBM,2020-01-29 00:46:52+00:00,"As long as it wasn't the latest Chinese virus that is killing people, I think it's nbd. Just remember that it's more important to wear a face mask if YOU'RE the one who's sick, than as a preventive measure. But both are important at big events like this."
myworldasana,2020-01-29 00:41:35+00:00,Don’t you find curious that every zombie movie/serie is related to a chinese virus #coronavirus
RufusHewitt23,2020-01-29 00:37:22+00:00,Has this Chinese virus come to the UK?? 
NewsLinda2,2020-01-29 00:36:37+00:00,Japan evacuees leave epicenter of Chinese virus https://newslinda.com/japan-evacuees-leave-epicenter-of-chinese-virus/
SamuelLucciano,2020-01-29 00:22:14+00:00,Deadly Chinese Virus Spreads to the US. How Did It Happen? https://youtu.be/AvhCNn68RKs vía @YouTube
DonstarDon,2020-01-29 00:21:57+00:00,http://www.donmurrayastrologer.com/news.html ..update on that Chinese Virus
FreeAirPress,2020-01-29 00:20:39+00:00,Conservative Radio Host Michael Savage Wants The ‘Coronavirus’ To Infect AOC: Send Her Animals From Chinese Virus Market 
TaterTotTylord,2020-01-29 00:10:24+00:00,I swear Im just trying to catch this chinese virus &amp; die
KaraiSoupCurry,2020-01-28 23:55:41+00:00,American stocks jimped back up. #ChineseVirus cannot mess with American prosperity https://n.news.naver.com/article/215/0000842620
johnwic43610981,2020-01-28 23:55:12+00:00,Chinese Virus Spreads | Hong Kong Anti-Communist Rally https://youtu.be/qy8oa6Ql-zM via @YouTube
ChandiniDeee,2020-01-28 23:51:03+00:00,"My sister is coming to SG next week and she asked us ""hows the situation with the Chinese virus?"" "
fmtoday,2020-01-28 23:47:03+00:00,"Chinese censors had worked diligently to remove public references to the outbreak, reflecting the communist party's SOP: secrecy and suppression. #FMTNews #Chinese #Virus"
ChrissyxRocco,2020-01-28 23:46:54+00:00,"I’m dead, my moms soaking her nails off and not getting them done because of the “Chinese virus” "
marc99041726,2020-01-28 23:35:20+00:00,"Climate change, bushfires & now the Chinese virus - utterly out of depth"
FlightGlobal,2020-01-28 23:35:03+00:00,Profitable Air Astana cautious over Chinese virus impact http://ow.ly/m7HZ50y71Bg
RossiMarinelli,2020-01-28 23:34:20+00:00,Hope you get that Chinese virus
Liam_Wood_,2020-01-28 23:33:57+00:00,"Going to drink 15 bottles of corona tomorrow mate, try and get this Chinese virus everyone’s been talking about."
themainichi,2020-01-28 23:30:11+00:00,Asian demand for face masks soars on fears of Chinese virus 
Jesvs0,2020-01-28 23:28:00+00:00,This Chinese virus is new to mankind. Please be safe out there. RT TO SAVE A LIFE.
HalkiewiczMa,2020-01-28 23:20:40+00:00,"Can he watch out of that Chinese virus, I start to worry about him "
JosephyneT,2020-01-28 23:16:55+00:00,Dread to think of the thousands of animals round the globe now suffering at hands of scientists to find remedy for effing chinese virus. Because they had to eat any moving thing. Rot. In. Hell.
evibenstein,2020-01-28 23:02:36+00:00,"Seriously, huge thanks to everyone who listens, or has ever listened to #OffTheChart - from me and @babel17 who's fallen foul of a nasty cold or some kind of Chinese virus or something tonight. We've another unexpected thing up our sleeves for next week so you'd better come back! "
CCIVoice,2020-01-28 23:00:07+00:00,"Travelers at 3 U.S. airports to be screened for new, potentially deadly Chinese virus "
GPZO,2020-01-28 22:59:41+00:00,Deadly Chinese Virus Spreads to the US. How Did It Happen? https://youtu.be/AvhCNn68RKs via @YouTube
JustKing93,2020-01-28 22:55:44+00:00,Us patent on the chinese virus
ShimmeringMess,2020-01-28 22:50:06+00:00,“Y’all fuck in the middle of the neighborhood without a condom but you afraid of a Chinese virus” I am at a loss for words in both languages 
uhNaiiqz,2020-01-28 22:45:02+00:00,The Chinese virus die because it’s made in China 
sadik54473265,2020-01-28 22:40:19+00:00,Chinese virus
Elucidatus,2020-01-28 22:27:58+00:00,Asian demand for face masks soars on fears of Chinese virus - Japan Today https://japantoday.com/category/business/asian-demand-for-face-masks-soars-on-fears-of-chinese-virus
Dougal128,2020-01-28 22:26:05+00:00,Chinese virus is turning people into diggers https://youtu.be/BDmwWSjaTro via @YouTube
Yung__Leee,2020-01-28 22:23:23+00:00,Let me catch that Chinese virus I’m straight coughing on my ex
asx_lf,2020-01-28 22:21:38+00:00,So have the Australian fires now ended because that Chinese virus has come to light .... yet another distraction from what the government are really hiding from us!
DNosknih,2020-01-28 22:17:27+00:00,That dudes got that Chinese virus thing. Look out!
jeremyc62527422,2020-01-28 22:14:36+00:00,HUAWEI risks will be kept away from nuclear power stations and secret stuff but you the people are fucked. The government don’t give a shit about your privacy. There is no such thing as a Chinese. virus right?
NaattyyRst,2020-01-28 22:06:33+00:00,"You guys have fucked mostly every girl in your ends but youse are scared of a Chinese virus, make it make sense pls"
SpotMonthEnergy,2020-01-28 22:04:01+00:00,WTI chat update #OOTT #natgas Room is experiencing a sea change in opinion as price bulls are calling out the $52 bears to no avail. Lots of China reports posted. APIs helped bull chats &amp; so did posted Chinese virus updates. Some chats of 6 days down in row (twice) since Jan 8
nacho_1007,2020-01-28 22:01:42+00:00,Deadly Chinese Virus Spreads to the US. How Did It Happen? https://youtu.be/AvhCNn68RKs vía @YouTube
rupieroop,2020-01-28 21:56:44+00:00,"Ontario school board concerned parents' petition prompted by coronavirus fears could stoke racism, xenophobia | CBC News https://www.cbc.ca/news/canada/toronto/coronavirus-chinese-stigma-york-regional-school-board-1.5443128?__vfz=medium%3Dsharebar. ""The school board said that while the virus originated in a Chinese city, it's important that it not be seen as a ""Chinese virus."""
JapanToday,2020-01-28 21:53:06+00:00,Asian demand for face masks soars on fears of Chinese virus https://japantoday.com/category/business/asian-demand-for-face-masks-soars-on-fears-of-chinese-virus?utm_source=twitter&amp;utm_medium=referral&amp;utm_campaign=dlvr.it
Megacurve,2020-01-28 21:49:37+00:00,"The first Japanese to get that Chinese Virus is a tour bus driver in his 60s from Nara. So caught it from Chinese Tourists. A lot of those around here, well close to here anyway. I find those masks fog up my glasses... "
Ufc26,2020-01-28 21:49:16+00:00,The Chinese virus was brought out right before Apple earnings purposely to fool people into shorting it. I predicted it Friday and said same thing yesterday. You can ask Carl C
Ufc26,2020-01-28 21:47:25+00:00,I knew they were going to fraudulently push this higher. They purposely cane out with Chinese virus close to apple earnings to purposely get people to sell and go short. Classic CNBC and Wall Street fraud. All orchestrated
Stevie_Wunda,2020-01-28 21:40:31+00:00,Chinese virus got Bitcoin boomin
mmmexperimental,2020-01-28 21:40:13+00:00,Conservative Radio Host Michael Savage Wants The 'Coronavirus' To Infect Alexandria Ocasio-Cortez (D-NY: Send Her Animals From Chinese Virus Market http://mediaite.com/a/ewvge via @mediaite
cjgarza3,2020-01-28 21:35:51+00:00,Deadly Chinese Virus Spreads to the US. How Did It Happen? https://youtu.be/AvhCNn68RKs via @YouTube
SilverFeather19,2020-01-28 21:31:01+00:00,"Good goly my nigga , I finally got it! Do a Chinese virus series where everyone gets infected buuut instead of people dying:( the virus turns everyone into thiCC girls your welcome "
village_jordan,2020-01-28 21:30:42+00:00,Silicon Valley rushes to stop ‘dis’ information re Chinese Virus could be why no more local videos + stories are surfacing like the 1st few days ?
Pammyreign,2020-01-28 21:24:36+00:00,New Israeli Masks Could Help Stop Deadly Chinese Virus | United with Israel 
tapeheadsjibm,2020-01-28 21:23:47+00:00,Well considering the deal you make with the DNC about removing Bernie Sanders from the Democratic primary. It wouldn't be suprising if you try to infect Bernie Sanders with this new Chinese Virus.
PurpleSkyzOOM,2020-01-28 21:20:14+00:00,“The Chinese virus is spreading”—deception and false news 
OptionRap,2020-01-28 21:17:42+00:00,$aapl Will announce a good quarter but it will not be enough to sustain the current price also they will delay some product because of the Chinese virus. Get ready for a 800 points down in two days. $iwm $spy $qqq @TicTocTick
JimHealthpub,2020-01-28 21:12:25+00:00,"Perhaps. And I really hope you have the antidote/cure for the new Chinese virus hidden somewhere. No big Pharma, no cures."
acf3301,2020-01-28 21:06:03+00:00,"The News: The mysterious Chinese virus can only be spread through human interaction Me, an engineering student: "
moonriverlady,2020-01-28 21:01:42+00:00,New Israeli Masks Could Help Stop Deadly Chinese Virus https://unitedwithisrael.org/new-israeli-masks-could-help-stop-deadly-chinese-virus/#.XjChNKVvtfk.twitter
TwoTigersonemo1,2020-01-28 21:00:20+00:00,Deadly Chinese Virus Spreads to the US. How Did It Happen? 
JJ20109163716,2020-01-28 20:52:37+00:00,Only Chinese virus can spread so effectively too 
RetroSempai,2020-01-28 20:43:28+00:00,I got that Chinese virus. Fucking PogU
ihatedylxne,2020-01-28 20:36:27+00:00,"Who’s the dumbass who didn’t take the chance to name the Chinese virus, Kung Flu"
JustShauna_,2020-01-28 20:35:58+00:00,"my mom called me 10 times dis morning tb that Chinese virus, the lady is OC "
Suzyiam,2020-01-28 20:32:28+00:00,"For a start there are other parties who will be running, plus independents. You don't even have an 'other' category. Scientifically it's has less value than a chinese virus."
nell_hunt,2020-01-28 20:30:36+00:00,Can you imagine what devastation there would be if that Chinese virus was found among SFO homeless souls living on the street?
stetho_wala_dr,2020-01-28 20:27:19+00:00,News- The mystery Chinese virus can only be spread through human interactions . Engineering students after hearing this 
OldManCanyon,2020-01-28 20:13:32+00:00,The perversion and complete disregard for animal life will continue to manifest diseases like this Chinese virus until we wake up and see beings/nature as equal to us and our duty to protect
RichardCR56,2020-01-28 20:10:23+00:00,#ChineseVirus coming this way? The Guardian view on #Huawei and 5G: the risks are real
gal_judi,2020-01-28 20:09:42+00:00,New Israeli Masks Could Help Stop Deadly Chinese Virus https://unitedwithisrael.org/new-israeli-masks-could-help-stop-deadly-chinese-virus/#.XjCVA-gEFC0.twitter
pequenolitle2,2020-01-28 20:03:47+00:00,It's because the chinese virus
Babak_J_T,2020-01-28 19:58:42+00:00,New Israeli Masks Could Help Stop Deadly Chinese Virus | United with Israel https://unitedwithisrael.org/new-israeli-masks-could-help-stop-deadly-chinese-virus/
gei_andre,2020-01-28 19:58:15+00:00,Deadly Chinese Virus Spreads to the US. How Did It Happen? https://youtu.be/AvhCNn68RKs #Coronavirus #ChinaWuhan #Wuhanvirus #China #ChinaUncensored #coverup #conspiracytheory
TRUTHSEEK9,2020-01-28 19:57:51+00:00,Deadly Chinese Virus Spreads to the US. How Did It Happen? https://youtu.be/AvhCNn68RKs via @YouTube
VaraSueTamminga,2020-01-28 19:56:43+00:00,WE ESPECIALLY PAY FRO ALL THOSE INFECTED BY THE CHINESE VIRUS WHICH MAY HAVE BEEN DELIBERATELY USED AS GERM WARFARE.
crueIwarrior,2020-01-28 19:55:40+00:00,that chinese virus apparently already spread in the uk omfg it was nice knowing all of yall 
KVchiro,2020-01-28 19:39:20+00:00,This is huge!!! New Israeli Masks Could Help Stop Deadly Chinese Virus | United with Israel 
Nubxrn1,2020-01-28 19:39:02+00:00,What I thought of when niggas were talking about a Chinese virus: 
NERV_0us,2020-01-28 19:34:03+00:00,everyone in the west crying so much over this chinese virus but still refuse to wear medical masks out when they sick lol
BorgohainR,2020-01-28 19:30:36+00:00,Heard that #coronavirus will not last long as it is a Chinese virus. #faltujoke
AnnaVannaBoo,2020-01-28 19:25:01+00:00,Scum! Conservative Radio Host Michael Savage Wants The 'Coronavirus' To Infect AOC: Send Her Animals From Chinese Virus Market http://mediaite.com/a/ewvge via @mediaite
denuribe73,2020-01-28 19:21:03+00:00,Conservative Radio Host Michael Savage Wants The ‘Coronavirus’ To Infect AOC: ‘Send Her To Chinese Virus Market’ https://www.mediaite.com/radio/conservative-radio-host-michael-savage-wants-the-coronavirus-to-infect-aoc-send-her-to-chinese-virus-market/ #SmartNews
OMAHAGEMGIRL,2020-01-28 19:18:32+00:00,Conservative Radio Host Michael Savage Wants The ‘Coronavirus’ To Infect AOC: ‘Send Her To Chinese Virus Market’ https://www.mediaite.com/radio/conservative-radio-host-michael-savage-wants-the-coronavirus-to-infect-aoc-send-her-to-chinese-virus-market/ #SmartNews
cc5211,2020-01-28 19:04:50+00:00,Should have been issued two weeks ago when first hint of Chinese virus became known. Since then thousands of travelers have mingled worldwide and this virus is now out there. Only thing we can do is protect ourselves. All outings anywhere cancelled.......
marlene676,2020-01-28 19:04:42+00:00,“The Chinese virus is spreading”—deception and false news https://blog.nomorefakenews.com/2020/01/27/the-chinese-virus-is-spreading-deception-and-false-news/
greenheyes,2020-01-28 19:03:24+00:00,If the Australian TV program Nothing to Declare is accurate Good Luck trying to contain this Chinese virus
eugene_pomianek,2020-01-28 18:57:26+00:00,Good place to send the Chinese virus
onekayeighty,2020-01-28 18:47:20+00:00,No need to travel when you will soon be able to get your Chinese virus right at home via your mobile!
DeanObeidallah,2020-01-28 18:43:36+00:00,How is not suspended for using the radio to call for AOC's death?!! Conservative Radio Host Michael Savage Wants The 'Coronavirus' To Infect AOC: 'Send Her To Chinese Virus Market' http://mediaite.com/a/ewvge via @mediaite
keats_mr,2020-01-28 18:37:04+00:00,"That Chinese virus has gone big time - it's got an anime girl version of it, and she's kinda cute"
GokItzz,2020-01-28 18:33:33+00:00,A person got a chinese virus and got fired from his job was killed #VirusChina #coronavirus
DangerGirl6,2020-01-28 18:32:22+00:00,Can you imagine the backlash if CNN news host said they’d like the virus to infect Trump? “Send Trump to the Chinese virus market” Hey @IvankaTrump no pithy comment of condemnation from you? #MAGA
mikelotus,2020-01-28 18:31:52+00:00,Conservative Radio Host Michael Savage Wants The ‘Coronavirus’ To Infect AOC: ‘Send Her To Chinese Virus Market’ 
uawoo,2020-01-28 18:31:42+00:00,Chinese virus expected to hit Swiss tourism industry 
dbrunsk,2020-01-28 18:26:28+00:00,"1,000 gun deaths per month in USA. Come on Canada. This Chinese virus does not come close to this stat and yet we all fear the virus more than guns"
Mediaite,2020-01-28 18:26:22+00:00,Conservative Radio Host Michael Savage Wants The 'Coronavirus' To Infect AOC: 'Send Her To Chinese Virus Market' http://mediaite.com/a/ewvge
KingKornBR,2020-01-28 18:25:16+00:00,"Guys... Dollar and financial markets in general continue to browse the news of the new Chinese virus and, any other has lost importance in the face of the fact. The market remains nervous, in Brazil, apparently the tendency of USD is bearish but it is reversed with each new"
sharnsimmonds,2020-01-28 18:24:41+00:00,So this is how we Go A never WWIII a just a Chinese virus
ArchUnicorn,2020-01-28 18:20:29+00:00,Operation Disclosure: The Chinese Virus is Spreading: Deception and Fals... 
rahadfield,2020-01-28 18:19:26+00:00,"Was in chemist earlier barking away, lady went to me 'you haven't got this Chinese virus have you?' One I hope not, 2 if I had i wouldn't be broadcasting, 3 and most important.... just because I have a bad cough doesn't mean you gonna catch the plague"
HealedLives,2020-01-28 18:17:02+00:00,“The Chinese virus is spreading”—deception and false news https://blog.nomorefakenews.com/2020/01/27/the-chinese-virus-is-spreading-deception-and-false-news/
bruhmomentking,2020-01-28 18:15:47+00:00,Protect Mediterranean girls from the chinese virus
nick_loves_edm,2020-01-28 18:13:13+00:00,"People really mad trippin on this corona virus shit.....if a Chinese virus kills me then fuck man , it was my time to go...."
RonnieChopra1,2020-01-28 18:08:27+00:00,Market reactions to past virus scares show stocks may have more to lose https://www.cnbc.com/2020/01/28/market-reactions-to-major-virus-scares-show-stocks-have-more-to-lose.html?__source=sharebar%7Ctwitter&amp;par=sharebar depends how serious the Chinese virus becomes - still early days.
opdisclosure1,2020-01-28 18:08:05+00:00,The Chinese Virus is Spreading: Deception and False News -- Jon Rappoport http://dlvr.it/RNwTyl
dailysunbd,2020-01-28 18:05:34+00:00,Asian demand for face masks soars on fears of Chinese virus-457903 
JENGLER1,2020-01-28 18:03:03+00:00,Probably also why you are prone to colds and other respiratory ailments. Middle East might be less dangerous regarding the Chinese virus but there does seem to be a bit of shooting and bombing there. Please please be careful! 
Benstrauss7,2020-01-28 17:54:45+00:00,"Odd how this whole Chinese virus ordeal is being said to be from food they eat, has there ever been a issue of the sorts from that food? My opinion is a bio weapon mis managed!"
scottcharp,2020-01-28 17:49:00+00:00,Hopefully its not the chinese virus
originalsaso,2020-01-28 17:33:56+00:00,"Bruh ive been sick from the flu these past two weeks. I cannot deal a chinese virus, my lungs wont take it"
jjiandani,2020-01-28 17:33:24+00:00,Asian demand for face masks soars on fears of Chinese virus (from @AP) https://apnews.com/22ced8ee2990681df8d0cf5dbaab5267
slimchick1900,2020-01-28 17:25:42+00:00,Please don't let it be true we can't handle the Chinese Virus in the Caribbean.
heretictrance,2020-01-28 17:23:26+00:00,"Trump ally Michael Savage on coronavirus: Send things from the “Chinese virus market"" to Rep. Alexandria Ocasio-Cortez "
penomarasan,2020-01-28 17:21:50+00:00,The Chinese virus will probably die very soon because it's made in china.. #coronarvirues
Denis3818,2020-01-28 17:16:48+00:00,Donald will rise the tariff for import Chinese virus.
yaarhammad,2020-01-28 17:14:06+00:00,*chinese virus singing while travelling to india*: Corona pyaar hai 
bcnn1,2020-01-28 17:03:42+00:00,Asian demand for face masks soars on fears of Chinese virus https://blackchristiannews.com/2020/01/asian-demand-for-face-masks-soars-on-fears-of-chinese-virus/
dearolaa,2020-01-28 16:54:23+00:00,That Chinese virus
100monkeys,2020-01-28 16:53:19+00:00,Chinese Virus Spreads | Hong Kong Anti-Communist Rally https://youtu.be/qy8oa6Ql-zM via @YouTube
mfgdotnet,2020-01-28 16:48:42+00:00,#Asian demand for face masks soars on fears of #Chinese #virus. Factories are rushing to boost #production as the number of #infections and deaths from #coronarvirues climbs. https://www.manufacturing.net/home/news/21112596/asian-demand-for-face-masks-soars-on-fears-of-chinese-virus #CoronaOutbreak #ChinaVirus
BLACKAN101,2020-01-28 16:42:54+00:00,See why I think Zim people shouldn't bother about that #coronavirus if y'all can survive water like that pssh what's a Chinese virus . Zimbos were happily eating meat laced with Listeria from South Africa &amp; going abt their business 
SALADIN12608488,2020-01-28 16:39:11+00:00,"Now the Corona Virus is known as ""Flying Chinese virus""! Can fly to Japan! Hahaha Newly invented Chinese FIGHTING WEAPONS! "
JudahGabriel,2020-01-28 16:36:24+00:00,"Did you hear about that Chinese virus going around, Coronavirus? They found a cure: switch to Dos Equis. "
RobertDurant7,2020-01-28 16:28:37+00:00,The Chinese gov't and USA gov't say there is nothing to worry about. #Chinese #Virus #Coronavirus Why worry.... See ya at 100K cases soon. And buy the dips on these #Virus stocks and sell rips
mspontecorvo,2020-01-28 16:26:34+00:00,This grandmother is waiting to hear from you! I am your best supporter and proudly defend you on Facebook! I get hammered for that! Now I need your help to address this Chinese Virus! I work with poor Black youth who could die
TribulationNow,2020-01-28 16:24:14+00:00,“The Chinese virus is spreading”—deception and false news https://blog.nomorefakenews.com/2020/01/27/the-chinese-virus-is-spreading-deception-and-false-news/
A_Fellow_Man,2020-01-28 16:21:48+00:00,Not too smart to insinuate Chinese families who are concerned about potential exposure as racist. Can someone be a racist against their own race? The virus is not a Chinese virus but it originated there and having it show up elsewhere does not change that China is ground zero.
iamWayneWeez,2020-01-28 16:15:06+00:00,"They Got A Chinese Virus Going Around? I Ate Chinese Food Almost Everyday Last Week , I Gotta Holla At Some Shit"
Aqurette,2020-01-28 16:11:33+00:00,Could This Chinese Virus Cause the Final Pandemic?: Sarah Boseley of the Guardian reports that Germany has confirmed a first human coronavirus transmission in Europe. https://aqurette.com/diary/2020/01/28/could-this-chinese-v
mspontecorvo,2020-01-28 16:07:54+00:00,Every achievement of your presidency is at stake if you don’t address the Chinese virus! We don’t care about trade! We care about our health! Please please give us your words of wisdom today
pahlrs,2020-01-28 16:03:30+00:00,"CORRUPTION is CONTAGIOUS in #TRUMP white house, as a Chinese VIRUS . "
DianeShears,2020-01-28 16:03:17+00:00,"""The Chinese virus is spreading"" ~ deception and false news | Jon Rappoport | https://blog.nomorefakenews.com/2020/01/27/the-chinese-virus-is-spreading-deception-and-false-news/ #coronavirus @nowtoronto @davidicke #China #WuhanOutbreak #oligarchy #cdnpoli #uspoli #ukpoli #EUpoli #onpoi #ottpoli #TOpoli #bcpoli #Agenda21"
VINNews,2020-01-28 16:01:02+00:00,In Photos: Chinese Virus Affect On Daily Life 
JosephScoggin17,2020-01-28 15:51:54+00:00,"Well I am ,except Im worried about the Chinese virus in the Corona they keep talking about on the news. Nothing better than a cold Corona after work..."
TheGodOfTrading,2020-01-28 15:42:51+00:00,#STOCKS - $WYNN down 10% on breadth signal plus #ChineseVirus news. #SellingStocksShort #StockOptionsPuts #StockTrading #10Ktrade
cjwilliamslat,2020-01-28 15:42:15+00:00,Asian demand for face masks soars on fears of Chinese virus 
streetsofgold11,2020-01-28 15:36:00+00:00,"Clove oil and also garlic kills all bacterial and viral illnesses. P.S. These two will also kill the Chinese virus, after all it's just a virus!"
npchilds,2020-01-28 15:34:39+00:00,That could be where you start on what they don't know about viruses. I'm guessing they're confused why a 'Chinese' virus is named after a 'Mexican' beer.
sofiaajoann,2020-01-28 15:30:33+00:00,Hopefully oomf gets that Chinese virus
LindaAsia123,2020-01-28 15:27:42+00:00,Maybe the virus outbreak will be over before the ramped up demand masks can hit the market as a Chinese virus expert says the virus may peak in 10 days time 
Ms1Scs,2020-01-28 15:25:12+00:00,"Hey, Leftists, it's time you partake in Commie meals, with Gutter Oil. You gotta go all the way! #chinesevirus #Communists #GutterOil #foodsecurity Watch this short clip:"
timo_sheya,2020-01-28 15:21:46+00:00,Still waiting to read a newsletter release on precautions regarding the Chinese virus. When Ebola broke out other countries were doing the most at their airports. Our Public Health Service is on it’s knees we can’t risk anything. It will be a global wipe out news. Take care 
