user,created_at,text
love_Thai_555,2020-01-29 09:05:31+00:00,【UAE confirms first cases of new Chinese virus in Mideast】 The United Arab Emirates on Wednesday confirmed the first cases in the Mideast of the new Chinese virus that causes flu-like symptoms. #coronavirus #2019nCoV #UAE
desktrading,2020-01-29 09:02:03+00:00,Dollar holds gains as investors assess damage from Chinese virus - Reuters https://www.reuters.com/article/global-forex/forex-dollar-holds-gains-as-investors-assess-damage-from-chinese-virus-idUSL8N29Y26Z
TalkatonKarl,2020-01-29 08:58:42+00:00,"If that Chinese Virus hits the UK, It's already hit France and Germany, Would they Cancel Cheltenham?? I would be traveling from Ireland, This is why alot of people are afraid to book"
freechina15,2020-01-29 08:56:04+00:00,"As a mother l so desperately try to protect my kid from this deadly Chinese virus , but our government , his school putting him at high risk!"
shravyamishka,2020-01-29 08:54:50+00:00,The United Arab Emirates on Wednesday confirmed the first case of the new Chinese virus that causes flu-like symptoms in the Mideast. #UAE #Virus
physorg_health,2020-01-29 08:50:58+00:00,UAE confirms first cases of new Chinese virus in Mideast 
TheresaDeena,2020-01-29 08:49:58+00:00,"Chinese virus? Not okay, Herald Sun. Not okay. #HeraldSun #coronavirus"
antipachajourno,2020-01-29 08:49:48+00:00,https://apnews.com › ... Asian demand for face masks soars on fears of Chinese virus - Associated Press 
todaynow8,2020-01-29 08:44:58+00:00,UAE confirms first cases of new Chinese virus http://www.today-now.com/uae-confirms-first-cases-of-new-chinese-virus/
starbizmy,2020-01-29 08:41:16+00:00,LVMH sales growth slows ahead of looming Chinese virus impact https://www.thestar.com.my/business/business-news/2020/01/29/lvmh-sales-growth-slows-ahead-of-looming-chinese-virus-impact
mcleanargus,2020-01-29 08:40:09+00:00,Demand for face masks soars on fears of Chinese virus 
timesofindia,2020-01-29 08:40:00+00:00,UAE confirms first case of new Chinese virus in Mideast http://toi.in/AhEGkb/a24gk via @TOIWorld
LordBoatrace,2020-01-29 08:37:18+00:00,Just to put this Chinese virus into perspective... The normal flu has killed 8200 and hospitalised 140000 in round about the same time period. Stats taken directly from CDC... Just sayin... 
StuartWelsh4,2020-01-29 08:33:53+00:00,I am glad that is all it is. Was first thing I saw this morning and thought you had the Wuhan Chinese Virus
DrUdomoh,2020-01-29 08:31:15+00:00,"Other names: Coronavirus Wuhan virus Chinese virus Chinese Coronavirus Chinese bug Watch out, there is already a suspected case in West Africa! #coronoavirus #CoronaVirusFacts"
janglo,2020-01-29 08:31:02+00:00,JERUSALEM LIFE:New Israeli Masks Could Help Stop Deadly Chinese Virus http://dlvr.it/RNyQGG
ljeko67,2020-01-29 08:25:43+00:00,If only there was a link between the Chinese virus and an alcoholic beverage that people could use for humorous purposes
Keren5099,2020-01-29 08:22:24+00:00,This chinese virus also.......... 
AjayStfc,2020-01-29 08:19:53+00:00,UAE confirms first case of new Chinese virus in Mideast – Times of India 
_WalkingArsenal,2020-01-29 08:18:09+00:00,𝚘𝚘𝚌┆: I don't know if you heard about that Chinese virus but apparently it's spreading where I live too.
StupidOzzies,2020-01-29 08:17:09+00:00,Thank Fuck for the Chinese virus it gets bushfires of front pages 
irlisrAlliance,2020-01-29 08:16:47+00:00,New Israeli Masks Could Help Stop Deadly Chinese Virus | United with Israel 
Alan__Zheng,2020-01-29 08:11:17+00:00,"Today, the Herald Sun's front page reads ""CHINESE VIRUS PANDAMONIUM."" Pandemonium intentionally misspelt because the pun and racebaiting is more important than media ethics. "
Omarr__O,2020-01-29 08:10:09+00:00,The Chinese virus will probably die very soon because it’s made in China
Alan__Zheng,2020-01-29 08:06:40+00:00,"Last Thursday, I warned that referring to the Coronavirus as a ""Chinese virus"" racialised the disease in a way unhelpful to the need for precise public awareness and also conflated the risks of a pathogen with that of a minority group vulnerable to racism."
JayDeepKarale,2020-01-29 08:01:11+00:00,Who knew real life Thanos would be a Chinese Virus. #coronavirus #nCoV19 #ncov2020
barb_davies,2020-01-29 08:00:20+00:00,Morning Mike raining here as well. Tbh got myself a bit worried here this morning 1st case of the Chinese virus in Dubai. It's just with Marc being so far away 
Zoe_suzi,2020-01-29 07:59:56+00:00,How dare you can call it Chinese Virus! Shame on you
sioblue_x,2020-01-29 07:52:03+00:00,Call me crazy but I really believe this deadly Chinese virus is just to distract us from brexit which is going through this Friday ?!! 
Newsmongerng,2020-01-29 07:51:36+00:00,UAE confirms first cases of new Chinese virus in Mideast 
joehick58,2020-01-29 07:43:36+00:00,"Trump ally Michael Savage on coronavirus: Send things from the “Chinese virus market"" to Rep. Alexandria Ocasio-Cortez "
Manzoor115,2020-01-29 07:42:34+00:00,They didn't do anything to control debt but they unleash Chinese virus by letting them entered into pakistan.
LearsFourTwenny,2020-01-29 07:36:11+00:00,"Big Mac taste good, Chinese virus doesn’t. Point proven mate. "
cal_rooks,2020-01-29 07:32:34+00:00,"You’re fucked then, potentially got that Chinese virus’s RIP was good knowing you"
worldfinmarket,2020-01-29 07:32:04+00:00,Hong Kong stocks pull Asian shares lower but futures offer hope: Asian shares fell on Wednesday as a spike in new Chinese virus cases sent Hong Kong stocks tumbling and added to worries about the economic impact of the outbreak.
whiotv,2020-01-29 07:29:39+00:00,UAE confirms first cases of new Chinese virus in Mideast https://www.whio.com/news/world/uae-confirms-first-case-new-chinese-virus-mideast/HVh5iCnsZVJY8P2mu1OzHJ/
WHIORadio,2020-01-29 07:29:36+00:00,UAE confirms first cases of new Chinese virus in Mideast https://www.whio.com/news/world/uae-confirms-first-case-new-chinese-virus-mideast/HVh5iCnsZVJY8P2mu1OzHJ/
daytondailynews,2020-01-29 07:29:33+00:00,UAE confirms first cases of new Chinese virus in Mideast https://www.daytondailynews.com/news/world/uae-confirms-first-case-new-chinese-virus-mideast/HVh5iCnsZVJY8P2mu1OzHJ/
tej6080,2020-01-29 07:23:57+00:00,"How do I get a refund? Reference Id: 20012110069930, Ticket Id: 20000000014124597. We cannot travel because of the Chinese virus."
katiefa88442438,2020-01-29 07:20:02+00:00,Imagine I left school early yesterday because I’m afraid of the coronavirus and I have to go in today and I’m so sick with fear because I’m a paranoid pip who thinks ballymahon will get an outbreak of a Chinese virus
ZineAfrica,2020-01-29 07:17:16+00:00,UAE confirms first cases of new Chinese virus in Mideast https://africazine.com/uae-confirms-first-cases-of-new-chinese-virus-in-mideast/
NabilAlSharif,2020-01-29 07:13:33+00:00,#UnitedArabEmirates has announced the first confirmed case of the new Chinese virus in the #MiddleEast. #coronoavirus
sonswpg,2020-01-29 07:12:06+00:00,the #coronavirus made me realize just how racist some of yall are..... ITS NOT A CHINESE VIRUS. by coincidence its in that area yes but there are OTHER COUNTRIES in the greater area that can be just as qued into this outbreak at any moment... shame on some of you
sonswpg,2020-01-29 07:11:38+00:00,the coronovirus made me realize just how racist some of yall are..... ITS NOT A CHINESE VIRUS. by coincidence its in that area yes but there are OTHER COUNTRIES in the greater area that can be just as qued into this outbreak at any moment... shame on some of you
SamDavidStudios,2020-01-29 07:05:55+00:00,#Asian demand for face masks soars on fears of #Chinese #virus https://japantoday.com/category/business/asian-demand-for-face-masks-soars-on-fears-of-chinese-virus
Co_Pilot2,2020-01-29 07:05:51+00:00,UAE confirms first cases of new Chinese virus in Mideast 
sunstaronline,2020-01-29 07:03:58+00:00,UAE confirms first cases of new Chinese virus in Mideast http://snstr.co/8c6
tutor2uSoc,2020-01-29 07:02:30+00:00,Catch up with this entry added yesterday to the tutor2u Sociology blog: Chinese Virus https://www.tutor2u.net/sociology/blog/chinese-virus #sociologyteacher #sociologyteacher #sociology
gersariel1,2020-01-29 07:00:12+00:00,UAE confirms first cases of new Chinese virus in Mideast - ABC News 
RobRe62,2020-01-29 07:00:10+00:00,United Arab Emirates announces the first confirmed case of the new Chinese virus in the Middle East. http://apne.ws/MnXcWFT Via @AP
cahulaan,2020-01-29 07:00:05+00:00,Hong Kong stocks pull Asian shares lower but futures offer hope: Asian shares fell on Wednesday as a spike in new Chinese virus cases sent Hong Kong stocks tumbling and added to worries about the economic… http://dlvr.it/RNyBkm #25thAmendmentNow #ImpeachTrump #TheResistance
ifoundmetonight,2020-01-29 06:59:12+00:00,UAE confirms first cases of new Chinese virus in Mideast united arab emirated https://abcnews.go.com/International/wireStory/uae-confirms-case-chinese-virus-mideast-68603807 @lookner #ChinesePneumonia #coronavirus #CoronavirusOutbreak
660NEWS,2020-01-29 06:50:29+00:00,UAE confirms first case of new Chinese virus in Mideast https://www.660citynews.com/2020/01/28/uae-confirms-first-case-of-new-chinese-virus-in-mideast-2/#.XjErIj_jhUA.twitter
themainichi,2020-01-29 06:45:46+00:00,UAE confirms first cases of new Chinese virus in Mideast https://mainichi.jp/english/articles/20200129/p2g/00m/0in/081000c
DonohueBlair,2020-01-29 06:43:11+00:00,Chinese virus ? 
NEWS1130,2020-01-29 06:40:04+00:00,UAE confirms first case of new Chinese virus in Mideast https://bit.ly/3aNh6ux
unbnewsroom,2020-01-29 06:38:38+00:00,#UAE confirms first cases of new Chinese virus in Mideast https://unb.com.bd/category/World/uae-confirms-first-cases-of-new-chinese-virus-in-mideast/42715
Vivian29477068,2020-01-29 06:37:03+00:00,"The name was CoronaVirus,rather than Chinese virus!!!"
getp2mask,2020-01-29 06:36:32+00:00,"#Coronavirus #UAE announces first case of #Chinese virus, in family from #wuhan"
xwaycomedy,2020-01-29 06:36:00+00:00,XWAYCOMEDY: New Chinese Virus Not Yet A Global Health Emergenc... 
SFGate,2020-01-29 06:33:03+00:00,UAE confirms first cases of new Chinese virus in Mideast http://dlvr.it/RNy83h
thus_spake,2020-01-29 06:28:31+00:00,"Coronavirus outbreak live updates: UAE announces first case of Chinese virus, in family from Wuhan "
RebeccaMorse10,2020-01-29 06:28:09+00:00,"Coming up on @10NewsFirstAdl the plans to evacuate Aussies from the Chinese virus zone, an update on the SA situation and what it means for Port's Shanghai trip. Also our tribute to @Sandra_Sully's milestone. See you soon."
nbcchicago,2020-01-29 06:27:52+00:00,UAE Confirms First Cases of New Chinese Virus in Mideast http://nbcchi.com/nn39yJj
ekaerospacenews,2020-01-29 06:26:33+00:00,Profitable Air Astana cautious over Chinese virus impact 
PulpNews,2020-01-29 06:26:04+00:00,UAE confirms first cases of new Chinese #virus in Mideast - Jan 29 @1:25 AM ET https://oddcrimes.com/static/2020/01/29/UAE-confirms-first-cases-of-new-Chinese-virus-in-Mideast.php
TOIWorld,2020-01-29 06:25:36+00:00,UAE confirms first case of new Chinese virus in Mideast http://toi.in/WMb3wZ
CARuthardt,2020-01-29 06:20:39+00:00,Conservative Radio Host Michael Savage Wants The ‘Coronavirus’ To Infect AOC: Send Her Animals From Chinese Virus Market https://www.mediaite.com/radio/conservative-radio-host-michael-savage-wants-the-coronavirus-to-infect-aoc-send-her-to-chinese-virus-market/ #SmartNews
worldnewsdotcom,2020-01-29 06:16:38+00:00,UAE confirms first case of new Chinese virus in Mideast #UAE #China #MiddleEast #Virus #ChineseVirus #WuhanCity
TALK1370,2020-01-29 06:16:11+00:00,HEADLINES: UAE confirms first case of new Chinese virus in Mideast 
LuzanoB,2020-01-29 06:13:07+00:00,UAE confirms first case of new Chinese virus in Mideast https://newsinfo.inquirer.net/1221119/uae-confirms-first-case-of-new-chinese-virus-in-mideast via @inquirerdotnet
KnaveYT,2020-01-29 06:12:46+00:00,Dude. All they said it was a new Chinese virus for some random average guy/woman to understand. It’s nothing big. If you read beyond the title they talk about the coronavirus
amyhybels,2020-01-29 06:10:10+00:00,UAE confirms first cases of new Chinese virus in Mideast https://apnews.com/e2145bb562ac9ee4a080af672b519068?utm_medium=AP&amp;utm_campaign=SocialFlow&amp;utm_source=Twitter
themainichi,2020-01-29 06:10:03+00:00,Asian demand for face masks soars on fears of Chinese virus 
BCNewsWire,2020-01-29 06:09:35+00:00,UAE #Dubai confirms first cases of new Chinese virus in Middle East #coronavirus #WorldNews
KnaveYT,2020-01-29 06:08:28+00:00,"I mean what’s easier for the average guy to identify, new Chinese virus or Wuhan Coronavirus, Wuhan a place they may or may not know."
gillchenxu,2020-01-29 06:07:20+00:00,"Not wise and not funny, it’s Coronavirus not Chinese Virus and Pandemonium not Panda-monium; i don’t believe this is what you want to tell the world while more than 100 people died from this"
tonytwt,2020-01-29 06:06:45+00:00,UAE confirms first cases of new Chinese virus in Mideast https://ktvu.com/news/uae-confirms-first-cases-of-new-chinese-virus-in-mideast
gurujeet212,2020-01-29 06:06:39+00:00,"Coronavirus outbreak live updates: UAE announces first case of Chinese virus, in family from Wuhan "
movphh_,2020-01-29 06:06:12+00:00,because i caught that chinese virus and finna die i’m gonna live my life to the fullest even if thag means staying up until 2am
Aroguden,2020-01-29 06:06:11+00:00,United Arab Emirates announces the first confirmed case of the new Chinese #Virus in the #MiddleEast. Vía @AP http://apne.ws/MnXcWFT
KnaveYT,2020-01-29 06:04:37+00:00,They never said it was the name. They just said new Chinese virus.
sunheat,2020-01-29 06:03:47+00:00,"Read this comment and sign the petition. So Ebola virus is not called Congo Virus, Vache Folle is not called Virus Européen or Virus Français, but this new coronavirus is called Chinese virus? Racism is NOT the issue. The real problem is racial DISCRIMINATION."
AP,2020-01-29 06:00:29+00:00,United Arab Emirates announces the first confirmed case of the new Chinese virus in the Middle East. http://apne.ws/MnXcWFT
ame_office,2020-01-29 05:55:55+00:00,"BREAKING: Diving World Series event scheduled for Beijing has been cancelled due to Chinese virus epidemic, which reportedly began in the now quarantined city of Wuhan, site of last year's Military World Games. The first two Diving World Series events will be Montreal and Kazan."
WOWK13News,2020-01-29 05:55:05+00:00,UAE confirms first case of new Chinese virus in Mideast 
nappy_techie,2020-01-29 05:53:16+00:00,So we just calling it Chinese virus now? SMH 
Paul22689512,2020-01-29 05:53:02+00:00,why are flights still allowed to and from China? This Chinese virus is due to their filthy animal breeding/killing/ eating practices in big cities. why should innocent Canadians get sick or die because Chinese want to live in or visit Canada.
MarkTLive,2020-01-29 05:52:24+00:00,UAE confirms first case of new Chinese virus in Mideast 
EmilyXue18,2020-01-29 05:46:45+00:00,"I believe the virus’s name was CoronaVirus, rather than Chinese virus."
thaddeus_akol05,2020-01-29 05:44:16+00:00,"It's a Chinese virus, naye this one is not like other Chinese products..kino kikambwe. "
voidtardis,2020-01-29 05:33:31+00:00,"Mr President, Chinese virus breakout is more serious than politics!!"
HedgehogOptions,2020-01-29 05:24:29+00:00,It took a crazy ass Chinese virus to to do it but PAP cracked it No doubt BeX. Phase III Falcon Heavy approaching final countdown
xTygerclaw,2020-01-29 05:05:54+00:00,"i coughed from my water and someone literally said ‘uh oh, u must got that Chinese virus going on’ i’m just like .. stfu"
JeffChangg,2020-01-29 05:02:38+00:00,How’d that Chinese virus get here before my Chinese delivery?
SagaciousNews,2020-01-29 05:00:01+00:00,“The Chinese Virus Is Spreading”—Deception And False News https://sagaciousnewsnetwork.com/the-chinese-virus-is-spreading-deception-and-false-news/
FHavg,2020-01-29 05:00:00+00:00,Profitable Air Astana cautious over Chinese virus impact 
YamaMedicine,2020-01-29 04:56:47+00:00,*starts throat singing to throw out the chinese virus away from mongolian soil* https://twitter.com/ftblpulisic/status/1221893759845183490
hollywoooooh,2020-01-29 04:53:49+00:00,"i have a biliary reflux whenever i hear ""chinese virus"" like? then they tell you ""its because the virus comes from china ""thank you for explaining or else i'd still be thinking to myself it was just a dehumanizing generalization based on stereotypes o colonialist superiority"
FMolina_Lima,2020-01-29 04:52:26+00:00,"""The Chinese virus is spreading""---deception and false news https://guidesblog.org/2020/01/27/the-chinese-virus-is-spreading-deception-and-false-news/ via @wordpressdotcom"
SpencerChew,2020-01-29 04:48:21+00:00,"First a big part of California goes up in flames and smoke, next two 737MAXs crash, taking almost 350 people with them to their deaths, swarms of earthquakes in many parts of the world and now a Chinese virus that’s fatal to catch?!?!#WhatTheHellIsTheWorldComingTo"
MrsMeliWilson,2020-01-29 04:22:08+00:00,"Conservative Radio Host #MichaelSewage Wants The ‘Coronavirus’ To Infect AOC: Send Her Animals From Chinese Virus Market, Or Maybe We Just Send Them To Mikey Boy Instead. #HappyInfectionMike https://www.mediaite.com/radio/conservative-radio-host-michael-savage-wants-the-coronavirus-to-infect-aoc-send-her-to-chinese-virus-market/ #SmartNews"
thessbprep,2020-01-29 04:19:49+00:00,Asian Demand for Face Masks Soars on Fears of Chinese Virus https://ssbprep.com/asian-demand-for-face-masks-soars-on-fears-of-chinese-virus
zakeeakardash,2020-01-29 04:13:18+00:00,How did that Chinese virus get here before the weave I ordered
Alexand01105642,2020-01-29 04:08:24+00:00,Get well soon hope you dont have the Chinese virus
Iwasthinking_,2020-01-29 04:06:53+00:00,"This person was taking a snap and saying that her friend who isnt wearing a jacket is going to get sick and going to catch the ""Chinese- virus"" and that ""you-people"" need to stay in your own country and eat bats and not spread stuff...""(cont)"
creekbear,2020-01-29 04:06:28+00:00,Conservative Radio Host Michael Savage Wants The ‘Coronavirus’ To Infect AOC: Send Her Animals From Chinese Virus Market #SmartNews SEND THIS GUY A ONE WAY TICKET TO WUHAN
RoeSroe794120,2020-01-29 04:05:53+00:00,with the chinese virus possibly spread over the united states as a pandemic with our democrat congress vetoing travel bans and ant our government dose 100 cases now . the evil anti american left bill let it spread if it is to their advantage
KaraiSoupCurry,2020-01-29 04:05:26+00:00,"After #ChineseVirus&gt; crisis, Ruble will stand the tsunami from USA. "
021Scenario,2020-01-29 03:57:10+00:00,It was priced in at 230ish.. but a slight pullback perhaps for the Chinese Virus then back to the top.
nellybear2167,2020-01-29 03:53:43+00:00,Hey Aust the little Sri Lankan family from Biloela are on Xmas island n wil now be subjected to this fatal virus aswell as being isolated from us ! Xmas island to be used as a quarantine station for Chinese virus evacuees
Yan_haoyan,2020-01-29 03:53:37+00:00,Chinese virus?? Seriously?? Is that how you conduct journalism in Australia—being a ignorant rasist? 
Hwnguyinjpn,2020-01-29 03:41:18+00:00,Asian demand for face masks soars on fears of Chinese virus https://japantoday.com/category/business/asian-demand-for-face-masks-soars-on-fears-of-chinese-virus#.XjD-3Zy5xJg.twitter
PurpleSkyzOOM,2020-01-29 03:39:26+00:00,“The Chinese virus is spreading”—deception and false news http://www.oom2.com/t67819-the-chinese-virus-is-spreadingdeception-and-false-news#146173 via @Forumotion
JiaAu,2020-01-29 03:39:04+00:00,Don’t agitate the people who are already in dire situations! As the Chinese post refutes this is #coronavirus not Chinese virus! EBOLA isn’t named Congo Virus! H1N1 not virus europeen nor fancais! @GlobalHealth @jeremyyoude
AttriForecast,2020-01-29 03:36:55+00:00,"Asian shares erased earlier gains, swinging into negative territory as a spike in new Chinese virus cases sent Hong Kong stocks tumbling and fuelled fears about the economic impact of the outbreak."
marcable1988,2020-01-29 03:34:54+00:00,seriously？CHINESE virus？？？ 
BivashPrasadS,2020-01-29 03:32:25+00:00,"Be careful from the ""Chinese virus"" if such symptoms are seen plz contact the local Doctor at the earliest "
VINNews,2020-01-29 03:30:02+00:00,Asian Demand For Face Masks Soars On Fears Of Chinese Virus 
ABSCBNNews,2020-01-29 03:30:00+00:00,"Japan, US evacuees leave Chinese virus epicenter as toll spikes "
lawyer4laws,2020-01-29 03:14:11+00:00,"Elizabeth Warren thinks because the Chinese Virus is call ""Corona"" . . It Means the SUN . . Hence Climate Change! "
Ardent_Grant,2020-01-29 03:08:43+00:00,"""Deadly Chinese Virus Spreads to the US. How Did It Happen?"" Via @ChinaUncensored"
JayFly,2020-01-29 03:08:13+00:00,This Chinese virus outbreak is crazy scary. I may never drink another corona
ReutersIndia,2020-01-29 03:00:15+00:00,"Asian shares erased earlier gains on Wednesday, swinging into negative territory as a spike in new Chinese virus cases sent Hong Kong stocks tumbling and fuelled fears about the economic impact of the outbreak https://reut.rs/2tYATXs #GlobalMarkets"
JLFernandez01,2020-01-29 02:53:26+00:00,When all the Airports in the countries surounding you are shutting down and you start getting isolated slowly but surely because of the New Chinese Virus... is time to get the hell out of… https://www.instagram.com/p/B74zMriBmUtLtwN7mWA5XS6zxj9h5dunrixUqs0/?igshid=9sxg5umhweiv
Rocky53152635,2020-01-29 02:51:14+00:00,Deadly Chinese Virus Spreads to the US. How Did It Happen? https://youtu.be/AvhCNn68RKs via @YouTube
mac2u,2020-01-29 02:43:48+00:00,Huawei: The other Chinese virus that’s infecting the world 
jhnamaral,2020-01-29 02:42:53+00:00,Man who pushed SARS dud now pushing new Chinese virus https://blog.nomorefakenews.com/2020/01/24/man-who-pushed-sars-dud-now-pushing-new-chinese-virus/
dianaaargh,2020-01-29 02:42:27+00:00,is Wuhan still in China? then yeah it’s a chinese virus fam
TraderTropical,2020-01-29 02:37:57+00:00,"It’s a man made Chinese virus. They’ve already innoculated party members and their families, time to wipe out rest of planet....."
cahulaan,2020-01-29 02:37:33+00:00,"Asian shares turn red as Hong Kong tumbles on China virus: Asian shares erased earlier gains on Wednesday, swinging into negative territory as a spike in new Chinese virus cases sent Hong Kong stocks… http://dlvr.it/RNxlNy #25thAmendmentNow #ImpeachTrump #TheResistance"
RICO01013,2020-01-29 02:37:21+00:00,The world is destroyed by the Chinese virus and HUAWEI. Chinese money is dangerous. Awake world． 
jhnamaral,2020-01-29 02:35:11+00:00,“The Chinese virus is spreading”—deception and false news https://blog.nomorefakenews.com/2020/01/27/the-chinese-virus-is-spreading-deception-and-false-news/
weijiasun84,2020-01-29 02:34:56+00:00,"Today's article calling the Coronavirus ""Chinese Virus"" is full of racism &amp; not acceptable in Australia. Do you dare to call the Ebola virus ""Black Virus""? ""PANDAmonium""? Shame on you for the cheap joke while innocent people are suffering. #Fakenews journalism."
rickhenry1775,2020-01-29 02:30:03+00:00,“The Chinese virus is spreading”—deception and false news https://blog.nomorefakenews.com/2020/01/27/the-chinese-virus-is-spreading-deception-and-false-news/
jason_om,2020-01-29 02:26:30+00:00,"So do only Chinese people get #coronavirus? Asking for the Herald Sun, which said it was a ""Chinese virus"". If so, I won't worry. I'm not Chinese! Gotcha. But remember when we used to say a disease belonged to a particular group of people? #auspol #wuhan"
chuckwi87998634,2020-01-29 02:25:04+00:00,Potential source of Chinese virus was germ warfare agent that got away from them a worker got it then spread it around this is most likely the sanario
zebralee,2020-01-29 02:24:23+00:00,Conservative Radio Host Michael Savage Wants The ‘Coronavirus’ To Infect AOC: Send Her Animals From Chinese Virus Market #SmartNews wth is wrong with ppl 
RayAngel12,2020-01-29 02:20:42+00:00,"Hopefully, someone there has that Chinese virus!"
rob_bargas,2020-01-29 02:08:30+00:00,"won't be a Chinese virus, but,,, expiring of old age is a thing"
CameronKosola,2020-01-29 01:54:12+00:00,Jse in 2016: Today we are going to play some 𝐏𝐥𝐚𝐠𝐮𝐞 𝐈𝐧𝐜. 𝐄𝐯𝐨𝐥𝐯𝐞𝐝! Now let's start in 𝐂𝐡𝐢𝐧𝐚. 4 𝒚𝒆𝒂𝒓𝒔 𝒍𝒂𝒕𝒆𝒓: Epidemic about a Chinese virus that has spread. Police: 
FireandAviation,2020-01-29 01:51:43+00:00,"Japan, US evacuees leave Chinese virus epicentre as toll spikes https://www.channelnewsasia.com/news/world/japan-us-evacuees-leave-chinese-virus-epicentre-as-toll-spikes-12363384#.XjDlLQ2wznc.twitter"
xixi_fairy,2020-01-29 01:46:19+00:00,"As a Chinese, I also hate people who eat wild animals. However, it is the coronavirus that is harming the Chinese. It is not the Chinese virus that is hurting the world."
PeterKHYM,2020-01-29 01:43:41+00:00,It’s a joke. the disease originated in China “we have to be cautious that this is not seen as a Chinese virus “ !?!? Maybe if we weren’t so afraid to offend anyone we would take real necessary precautions.
kiraaKarice,2020-01-29 01:41:57+00:00,The Chinese virus
comrade_sobble,2020-01-29 01:39:09+00:00,I mean you should still rinse it cause it cooks better but stop fearmongering this is why idiots are afraid of scary yucky Chinese virus people but won’t get flu shots
