user,created_at,text
JoydeJoe,2020-01-30 23:53:18+00:00,write your will. you got that Chinese virus 
Teddyshouse2II,2020-01-30 23:37:15+00:00,"Do you trust @realDonaldTrump to protect our Children and Grandchildren, here in the United States from the Chinese Virus?"
JohnBro13002328,2020-01-30 23:23:57+00:00,Yep. STV just looking for one person with Chinese virus. It's as if it's their target. Pathetic
lewishone2213,2020-01-30 23:20:09+00:00,"Only arrow park hospital would be stupid enough to take someone who potentially has this Chinese virus straight off a from China and quarantine them , won’t catch me going there anytime soon"
notfalsenews,2020-01-30 23:18:13+00:00,We have to remember that SARS and this virus originated in the appalling live animal markets of China - yes it is a Chinese virus and yes the Chinese need to do something about these markets so the next virus is not a ‘Chinese’ virus
LoveLakeLifeKim,2020-01-30 23:16:29+00:00,"Appreciate that as an RN/House Sup. Everyone that has a sniffle is packing my ED. I’ve heard it called Corona, Canary, Cornea, many just Chinese virus. I love my job &amp; do my best to educate, but it’s a challenge sometimes."
bridgesforindy,2020-01-30 23:16:16+00:00,We will need the broad shoulders of the humanitarian catastrophe ( UN reporter ) of the English NHS to protect us from the global pandemic of the Chinese virus because our Scottish NHS is so absolutely terrible. At least it wont arrive by the ferry company with no ships
frasergoodwin,2020-01-30 23:15:26+00:00,Thank god we’ve got the opinion of the head of the farmers union to help us better understand the risk of a dangerous Chinese virus.
GunterFrancisco,2020-01-30 23:11:06+00:00,What makes this worse is Xenophobic America doesn’t categorize as a “Chinese virus” but an Asian virus 
andrewleeke,2020-01-30 23:09:28+00:00,"Wow, it's amazing how panicked everyone on @bbcquestiontime seems to be about the chinese virus outbreak. Calm down and do some research."
RendleGary,2020-01-30 23:08:28+00:00,"Chinese virus may be contagious. So let's fly 200 people back in a plane with air-con. If one has it , they all now have it. Then, it gets better, let's drop them off in southern England, then transport them 250 miles North by road."
clhubes,2020-01-30 23:06:09+00:00,"Americans will wear a mask to the airport because they think a mysterious Chinese virus will kill us all but won't get a flu shot because ""they never get sick!"""
JinfengZhong,2020-01-30 23:01:43+00:00,"Bovine spongiform encephalopathy came from England and spread to other countries,nobody calls it ""English virus""; Ebola virus came from congo, nobody calls it ""Congo's virus"". But why, now you call the new disease ""Chinese virus""? Double standard, evidently. Isn't it?"
JinfengZhong,2020-01-30 23:00:21+00:00,"Bovine spongiform encephalopathy came from England and spread to other countries,nobody calls it ""English virus""; Ebola virus came from congo, nobody calls it ""Congo's virus"". But why, now you call the new disease ""Chinese virus""? Double standard, evidently. Isn't it?"
JinfengZhong,2020-01-30 22:59:59+00:00,"Bovine spongiform encephalopathy came from England and spread to other countries,nobody calls it ""English virus""; Ebola virus came from congo, nobody calls it ""Congo's virus"". But why, now you call the new disease ""Chinese virus""? Double standard, evidently. Isn't it?"
fisherwang620,2020-01-30 22:59:13+00:00,Do you have some comment on SOCIALISM Chinese virus emergency?
mr12essex,2020-01-30 22:58:17+00:00,@LBC off to my local chinese just our daily outfits ! #chinesevirus 
_clarbohydrate,2020-01-30 22:48:20+00:00,"I’ve seen the virus referred to as the “Chinese virus” on multiple news sources. It’s just dangerous microagressions like that can lead to a bigger problem, like how Ebola was connected to African Americans."
sherylucky1,2020-01-30 22:47:01+00:00,"About the new chinese virus going around. One of my brothers is like Waters. One in 1,000 so darn healthy. Can go anywhere never catch that crap. But most people are average Joe's like you and me,. So let's stop anyone coming in. You can go but must wait to come back. "
MariaMouquinho,2020-01-30 22:46:37+00:00,This 'chinese virus' was patented in America in 2007?? https://blogfactory.co.uk/2020/01/30/this-chinese-virus-was-patented-in-america-in-2007/ via @Bumbleslumber
JinfengZhong,2020-01-30 22:45:49+00:00,"Bovine spongiform encephalopathy came from England and spread to other countries,nobody calls it ""English virus""; Ebola virus came from congo, nobody calls it ""Congo's virus"". But why, now you call the new disease ""Chinese virus""? Double standard, evidently. Isn't it?"
steveglenda,2020-01-30 22:39:17+00:00,"BBC lets scare munger about the Chinese virus that isn’t here, send fake news itcould be here, shame on you"
AgenciaAJN,2020-01-30 22:34:43+00:00,"#UAE confirms 4 cases of new Chinese virus, the first in #MiddleEast https://agenciaajn.com/noticia/emiratos-arabes-unidos-confirma-cuatro-casos-de-coronavirus-los-primeros-en-medio-oriente-134434"
JohnBaker1975,2020-01-30 22:30:55+00:00,Or a Chinese virus 
JohannMurdoch,2020-01-30 22:24:03+00:00,I agree the shit fest will hit soon because Boris now has to deal with reality and not slogans -Hauwei-HS2-the budget -Chinese virus -the real deal of Government-that can’t be blustered by slogans
KnightOfRetail,2020-01-30 22:22:17+00:00,Where did WHO state it as a “Chinese” virus? Did you give Zika versus a nationality ? It a new virus.
Barnesm_,2020-01-30 22:17:02+00:00,"No mention of the massive degree of racism in Australia over this virus, with the Murdock paper calling it 'The Chinese Virus' PANDAmonium."
_aloo_gobi,2020-01-30 22:16:06+00:00,"This thread... racism doesn’t just exist in kids, they learn it from what’s around them. Parents, media, all those people who are calling this a “Chinese virus” you guys all suck. "
JJFarrell451,2020-01-30 22:07:10+00:00,"I saw the headline WHO leader declares Chinese virus blah, blah, blah and automatically thought Pete Townshend said what!?..."
sanguis_malus,2020-01-30 22:01:51+00:00,Those chinese virus is spreading so fast and attacking not only lungs but brain as well.
LeggeCali,2020-01-30 21:59:33+00:00,I swear to god if I get this fricking Chinese virus and die ov it am not going to be happy!! 
DougKCarnivore,2020-01-30 21:57:13+00:00,way many more lives have been lost to abortion by choice than this Chinese virus... context matters.... 
cupgala,2020-01-30 21:46:54+00:00,"WHO has never referred this virus as Chinese virus, always as novel coronavirus. It should never be called Chinese virus, just as we don't call Zika virus Brazilian virus, never call Ebola virus as Congo virus."
luccceh,2020-01-30 21:46:38+00:00,"Done my tan so at least if I catch this Chinese virus, I’ll still look good."
rbfritzler,2020-01-30 21:36:11+00:00,I don’t think I have that Chinese virus but when I sneezed this morning it sounded like wuuu Han! And then I found this evidence. 
ceg1095830776,2020-01-30 21:35:44+00:00,"We dont call EBOLA 'Congo VIRUS', we dont call vache folle 'virus europeen' or 'virus francais', of course we dont call corona virus 'Chinese Virus'. but i think you r in very very sicking. shame on you , racist."
AwannabePu,2020-01-30 21:32:30+00:00,"I've read ""virus"" instead of ""various"". It becomes more difficult to think about seduction as the Chinese virus keeps spreading. We'll have to forget about approaching girls as soon as the disease reaches the Chinese level in our countries."
eloarefab,2020-01-30 21:15:38+00:00,"Tim.....corona virus originated in China, the majority of those affected are Chinese. It's a Chinese virus. Simple."
aboisatypo,2020-01-30 21:01:43+00:00,"honestly. people out here. we all breathe the same air ok. we all the same cell. get over yourself, this isn’t a “Chinese virus”. issa virus virus"
dprmichelle,2020-01-30 20:58:31+00:00,The corona virus is once again giving racists a “reason” to be racist and xenophobic. This is not a “Chinese virus.” It is a virus that is killing people all over the world. Viruses don’t have a race.
360CNN,2020-01-30 20:58:05+00:00,"Why would Zionists in Israel, US Pentagon release the mystery Chinese Virus? 1) To gauge how effective Chinese virologists can combat it 2) To demonize Chinese people and Nation 3) To slow down China's juggernaut steller economy 4) To push manufacturing into leaving China @MSNBC"
houssam_007,2020-01-30 20:57:10+00:00,11 fact you should know about coronavirus and how to protect yourself ! #coronavirus #CoronavirusOutbreak #chinesevirus Show More :
Mehmetvefadag,2020-01-30 20:52:36+00:00,Almighty Allah keep South AFRICA safe from this evil Chinese virus
savgalriri,2020-01-30 20:47:23+00:00,"white girl: omG! An asIAn persOn coUghed!! chinese virus gon Get me!! )): asian folks: um, that’s racist white girl: it’s noT my fauLT u eat yuCkY food!! WhY canT u JUST eAT norMaL fooD!! :P I’m not racist!! I love sushi &lt;3"
Mehmetvefadag,2020-01-30 20:45:39+00:00,We pray this killer Chinese virus don't visit South Africa...otherwise we will collapse...
vicheth24116667,2020-01-30 20:44:33+00:00,Stopping Chinese virus imports is bad for economy????? Totally agreed Hun Sen is the world most stupid minister!! 
PeteCormack,2020-01-30 20:43:47+00:00,Peter what the F#ck have we come to maybe this Chinese virus is a sign to say Eat veg and chicken
TerenceTerrier,2020-01-30 20:36:26+00:00,Can't be too careful wiv dat Chinese virus on da loose. It gonna be like dat TV programme Survivors wot mum told me abowt. #keepfits
JWEZEE,2020-01-30 20:30:36+00:00,"I wanna feel sorry right now for the chinese on this #Chinesevirus issue,b ut alot of them are racist, matter of fact a lot of Asian countries are! "
may252011,2020-01-30 20:30:10+00:00,Conservative Radio Host Michael Savage Wants The ‘Coronavirus’ To Infect AOC: Send Her Animals From Chinese Virus Market This guy is disgusting 
Tslammer4000,2020-01-30 20:27:56+00:00,For those of you who work in a professional setting. Introduce yourself or greet from a 6 foot distance and client is 70% less likely to reach out for a hand shake.. keep your hands to your self and don’t get the dirty Chinese virus.
ForcedToTwitt,2020-01-30 20:25:27+00:00,"I asked The Knack what they thought of the Chinese virus, they just said: https://youtu.be/g1T71PGd-J0 I'll get my coat"
HeiressMommy,2020-01-30 20:06:44+00:00,@SecretaryRoss How dare you? Time to investigate as to the very real possibility you are stopping our USA GOVERNMENT from addressing this potential world epidemic. You are an idiot - Coronavirus is NOT a “Chinese virus”!!! #WilburRossMustBeFired
topgooner100,2020-01-30 20:06:44+00:00,Yup Wendy has that Chinese virus thing #Emmerdale
mandycraggs1,2020-01-30 19:57:03+00:00,I will NOT be getting any Chinese virus!!! Steer clear you jerks!!! 
ikvecom,2020-01-30 19:52:37+00:00,"Today, at the beginning of the world, there is the Chinese virus trouble. Everyone should be informed and take precautions. We @coranavirus team As we will continue to inform people. We look forward to your support. #WuhanChina #Wuhan #coronavirues #chinaVirus"
tripledune,2020-01-30 19:51:13+00:00,why the mask? she got the chinese virus or what
TheSNFD,2020-01-30 19:41:11+00:00,We trust you more than Fake Chinese virus ....
CharlieHudson2,2020-01-30 19:40:32+00:00,I’m actually worrying that I have this Chinese virus. I’m so ill 
CarolineCreator,2020-01-30 19:37:58+00:00,"If they were, we would not know for certain for a while. I believe the chinese virus is a cover for their financial woes. They are toast. Imagine a world where we have no debt, free energy, health and wonder. Banks must have reserves against which to loan. They dont. Already bust"
WestHamRambles,2020-01-30 19:28:09+00:00,"God: I'll cut you a deal, you can win the Premier League at a canter, but you'll all the die of some dodgy Chinese virus. Scousers: Dat's sound la'. "
globaltimesnews,2020-01-30 19:20:02+00:00,"More than 46,000 Chinese have signed a petition on @Change requiring Australian media @dailytelegraph and @theheraldsun to apologize for ""race discrimination."" The tabloids labeled the novel coronavirus as ""Chinese virus"" and hyped xenophobia sentiments. http://bit.ly/38W1XFp"
bitcashio,2020-01-30 19:17:51+00:00,"it is not going to happen, it's still basically a chinese virus and not a very deadly one at that... until it mutates and turns everyone into ZOMBIES"
GrannySeniors,2020-01-30 19:13:25+00:00,Why don't you both be the greeters at the airports for these possible Chinese virus carriers. 
EurekaStockade3,2020-01-30 19:12:14+00:00,Jan was a busy month for the Globalist IllumiNazis Fake Impeachment Fake Killing of Soleimani Fake Iranian missile strikes Fake Chinese virus Fake helicopter crash Israeli Deal New NAFTA Deal Brexit #qanon
robertdarby6001,2020-01-30 19:05:15+00:00,CDC Confirms First Case Of Person-to-Person Transfer of Deadly Chinese Virus Inside USA 
CeriCollins,2020-01-30 19:03:28+00:00,Anyone got any of that Chinese virus knocking round please? 
TCMaefield,2020-01-30 18:54:11+00:00,New Israeli Masks Could Help Stop Deadly Chinese Virus | United with Israel 
EirikrHinnRaudi,2020-01-30 18:53:46+00:00,>Chinese Virus &gt;Chinese people &gt;Is cautious towards Chinese people who came here from China &gt;Is then called racist for being scared for my own health and well being 
mammalibog,2020-01-30 18:52:27+00:00,"Anyone who says “chingchong” in my feed will be instantly blocked. The virus that has been circulating is not a “chinese” virus, just like ebola isn’t an “african” virus. The virus originated in china but being racist to chinese people already residing here is shitty as fuck"
BRJ259,2020-01-30 18:51:16+00:00,Rojo leaves and now I’m gonna die from a Chinese virus. Happy 2020
MpM46343799,2020-01-30 18:49:17+00:00,"Time to take the vote, America is now ready to hang it up, they are far to worried about the Chinese Virus."
jay11w,2020-01-30 18:41:46+00:00,"Chinese virus, that's what it is!"
dga965,2020-01-30 18:38:32+00:00,"More about the Chinese virus. Today, a friend of mine returned from China (a resort on Hainan Island). Very strict control at the airport upon departure and upon arrival. And now she is obliged to undergo a medical examination every three days (for free)."
SharmaShailley,2020-01-30 18:34:25+00:00,Here's how Chinese residents are entertaining themselves while on lockdown #coronavirusindia #PrecaucionVial #chinesevirus @ChinaDaily #FridayThoughts
FULLDEFENCE,2020-01-30 18:31:09+00:00,CDC Confirms First Case Of Person-to-Person Transfer of Deadly Chinese Virus Inside USA https://newsthud.com/cdc-confirms-first-case-of-person-to-person-transfer-of-deadly-chinese-virus-inside-usa/
AshleyNatter,2020-01-30 18:30:49+00:00,"Because it's a Chinese virus, and we don't know anything about the Chinese whatsoever, maybe the virus knows Kung Fu!"
Jay_Mayedpd,2020-01-30 18:30:33+00:00,"This is what I've been saying, my classmate has been calling it ""the shitty chinese virus"" so I had to cuss cuz that's so wrong "
trust_ati,2020-01-30 18:30:27+00:00,Good product sales but #soybeans disappoint in spite of some PRC biz; demand worries from Chinese virus weighs: March: -$.15; May: -$.1450; March Meal: -$4.30; May: -$3.70
1055WDUV,2020-01-30 18:30:02+00:00,What are you more concerned about - flu or coronavirus? #flu #coronavisus #flueseason #innoculations #vaccines #Chinesevirus #traveladvisory #surgicalmasks #uselessmasks https://bit.ly/2OaI9X4
maalmaker,2020-01-30 18:29:26+00:00,This Chinese virus is spreading like wildfires walaai.
NeonNettle,2020-01-30 18:28:31+00:00,CDC Confirms First Case Of Person-to-Person Transfer of Deadly Chinese Virus Inside USA READ MORE: 
IMAKOS,2020-01-30 18:27:53+00:00,"Trump here enjoy Chinese virus’ could have been spread by bat soup after disturbing footage emerges https://www.standardmedia.co.ke/article/2001357665/chinese-virus-could-have-been-spread-by-bat-soup-after-disturbing-footage-emerges The deadly coronavirus, which has already killed 17 people, could have been spread by bat soup - a popular delicacy in Chinese city Wuhan."
IMAKOS,2020-01-30 18:27:20+00:00,"Chinese virus’ could have been spread by bat soup after disturbing footage emerges https://www.standardmedia.co.ke/article/2001357665/chinese-virus-could-have-been-spread-by-bat-soup-after-disturbing-footage-emerges The deadly coronavirus, which has already killed 17 people, could have been spread by bat soup - a popular delicacy in Chinese city Wuhan."
Johns2013M,2020-01-30 18:25:53+00:00,WASTE of TIME -- Its like that CHINESE VIRUS -- No CURE yet -- just DEADLY arrival
AsmaParekh,2020-01-30 18:24:30+00:00,Chinese virus filled its poison frm dis indian virus.. 
Insentra2,2020-01-30 18:21:34+00:00,"But the virus is a Chinese virus, it originated in China. Ebola was an African virus, it originated in Africa. Stop trying to turn a swimming pool into an ocean, it really isn’t this deep "
ALancashirelad,2020-01-30 18:13:54+00:00,So the WHO are about to declare a world wide emergency on this Chinese virus..and develop a vaccine by the end of the year.170 people thats 170 have died... emergency? You dont get it folks do you?
RudraGo13817532,2020-01-30 18:05:17+00:00,"Chinese virus itself kills many. Indian virus, shoots on others' shoulders."
shaunywelch,2020-01-30 18:04:10+00:00,"Genius way to extend your holiday. Cough cough, must be that Chinese virus thing. Best we all stay on this luxury cruise liner. Just to be safe of course. 2 extra weeks should do it "
eleceno1,2020-01-30 17:51:41+00:00,"""Its not racist cause it's a chinese virus! Also we should round up and put into camps anyone with yellow skin and they're also filthy animals for eating food we dont have here in the uk"" (while stuffing a battery farmed chicken burger into their mouth for extra effect)"
essemuk,2020-01-30 17:46:36+00:00,"What is Corona? , that is a virus from China (Chinese virus) ,China ,look at what you have thrown to the world ,we are all in panic ,so am here praising the good Ugandan air kumbe this virus has platforms in air. China ,we shall never forget this courtesy uproar"
spitfiresblog,2020-01-30 17:45:45+00:00,Swedish media calls for action against attacks from Chinese officials We have special breed of Chinese virus in Stockholm. 
namkeen_mirchi,2020-01-30 17:43:21+00:00,Isn't Shaheen Bagh type gatherings posing grave risk to Delhites from virus spread particularly in wake of Chinese Virus. Can the organisers held criminally responsible for endangering public life in case of spread of disease @aajtak @ndtv @toi @BJP4India
Flerpster,2020-01-30 17:42:59+00:00,Flying to Indonesia on Saturday for 3 week holiday. Was very excited but now my wife has got flu and just heard that the airport inJakarta is now using body temperature scanners for this fucking Chinese virus....fuck sake!! 
liyichunhs,2020-01-30 17:40:03+00:00,"“The virus was originated in Wuhan city in China, it s important that it should not be treated as a “China Virus” or ""Chinese virus"".Just like Ebola, which came from Congo , we should not call it as Congo Virus ; N1H1, we should not call it as European virus”"
eldemar_o,2020-01-30 17:36:57+00:00,"@BBCWorld @itvnews @Channel4News just in case you hadn't noticed. it's called news, might be a bit more interesting than just the continual yadda about the chinese virus. "
ELI_G33,2020-01-30 17:35:51+00:00,Or its that chinese virus they talkin bout in the news 
TSHIRTJOHNNY,2020-01-30 17:34:57+00:00,"WARNING TO HELP STOP THE CHINESE VIRUS THAT'S KILLING PEOPLE &amp; SPREADING AROUND THE WORLD AVOID TRIPS TO CHINA ! WEAR FACEMASK IN HEAVENLY POPULATED AREAS SUCH AS PUBLIC TRANSPORTATION ! AVOID FRIED OR SPICY FOOD TAKE A LOT OF VITAMIN C, STAY HOME AS MUCH AS POSSIBLE ! BEWARE ! "
trdrmtscdr,2020-01-30 17:20:12+00:00,Chinese Virus Concerns Dampen Sentiment https://tradermeetscoder.com/chinese-virus-concerns-dampen-sentiment/
RobsStang,2020-01-30 17:18:46+00:00,Once this Chinese virus gets on the go ... you’ll understand
jweglarznc,2020-01-30 17:08:24+00:00,"The other Chinese virus is very bad, #Huawei: The other #Chinese #virus that's infecting the world"
_janece1,2020-01-30 17:06:32+00:00,She got that Chinese virus
Gr8Burgos,2020-01-30 17:00:41+00:00,Fuk Everything!!! Fuk the Chinese virus fuk your bs life problems...@LilTunechi aka LIL WAYNE DROPS HIS NEW FUNERAL ALBUM TONIGHT AT 12!!!! I can’t wait for that blunt spark and him going crazy on songs!!!!
EhRadioCanada,2020-01-30 16:59:58+00:00,suggest you take a listen to this 'EHR 657 Morning moment Chinese virus or is it Canadian? Jan 29 2020' 
monkeymarv,2020-01-30 16:55:16+00:00,"I call it ""Chinese virus"" because it is. I'm not listening to any menstruating heart BS about not stigmatizing China. As per NJ Dept of Health: ""2019 nCoV (Novel Coronavirus, Wuhan, China)."" Japan doesn't like ""norovirus"" because Noro's a family name? Fuck 'em. Speak what's true."
zevaferrante,2020-01-30 16:51:49+00:00,“The Chinese virus is spreading”—deception and false news https://blog.nomorefakenews.com/2020/01/27/the-chinese-virus-is-spreading-deception-and-false-news/
dk_adams,2020-01-30 16:42:01+00:00,Conservative Radio Host Michael Savage Wants The ‘Coronavirus’ To Infect AOC: Send Her Animals From Chinese Virus Market. He seems nice.... https://www.mediaite.com/radio/conservative-radio-host-michael-savage-wants-the-coronavirus-to-infect-aoc-send-her-to-chinese-virus-market/ #SmartNews
fcj316,2020-01-30 16:30:49+00:00,African nations take first measures to stop spread of Chinese virus https://news.yahoo.com/first-african-measures-stop-spread-chinese-virus-174014127.html?soc_src=strm&amp;soc_trk=tw via @YahooNews
Ra_conteur,2020-01-30 16:30:13+00:00,Inn Flu In Sir? Is this an evolved version of that Chinese virus only found in males staying in South Beach hotels?
PyaraMomo1235,2020-01-30 16:28:25+00:00,Probably infected by that Chinese virus lol
BL0NDESUNG,2020-01-30 16:27:00+00:00,ugly white bitch infront of me in french class sneezed once and started screaming that she had “chinese virus” and every1 was laughing exept me Oh how I hate every single soul in my skewl 
kyferholdings,2020-01-30 16:23:49+00:00,@KagutaMuseveni .Mr president what are your contingency plans about the egregious Chinese virus.?
FeralWillieMan,2020-01-30 16:20:17+00:00,Isn’t he Japanese and the flu is a Chinese virus? Come on people
kulchinonso,2020-01-30 16:16:20+00:00,American hand may not be far from this Chinese virus
EhRadioCanada,2020-01-30 16:16:05+00:00,So if you listen to my latest podcast you will learn where the Chinese virus comes from MSM and Government in denial https://www.spreaker.com/episode/22177638 @realDonaldTrump @MichelleRempel #cwr #cdnpoli
pdanielagc,2020-01-30 16:14:27+00:00,"Ahhhh, the typical campaign about a chinese virus (nCoV) where the virus itself has asian eyes. Harmless at all, innit? What about some math symbols? Perhaps this Corona Virus is quite smart as any other asian guy... "
DevTelecoms,2020-01-30 16:05:03+00:00,Chinese virus hits Indian supply chain #India #Smartphones #China #PublicHealth #Components #Coronavirus http://tinyurl.com/rkwg5dt
Brahmas92572355,2020-01-30 16:04:46+00:00,Swairus more dangerous then that Chinese virus of china... 
Undercoverman7,2020-01-30 15:59:11+00:00,"If you don't nip the Chinese virus in bud, impeachment could be side story. 6 carnival cruises cancelled from China, one with 6000 on board with suspect case can't leave Italy.Good luck "
CurmudgeonPinoy,2020-01-30 15:59:04+00:00,What's next? This is the embodiment of Chinese Virus. #coronavirus #nCoV #chinesevirus 
Notorious_Vale,2020-01-30 15:58:02+00:00,"Fellas, is it racist to not want to die from the Chinese virus?"
bforres87965230,2020-01-30 15:53:22+00:00,Did the virus originate in china? Yes so its a chinese virus. Stop trying to make things racist when there not
Taoistguy457,2020-01-30 15:49:36+00:00,"""Mortgage rates tumble...amid uncertainty about the Coronavirus"" Chinese Virus, American Home Mortgages? I get those who don't see Mortgage Futures doing well. The rest, that's just fear and panic talking. #QAnon"
brennal,2020-01-30 15:49:23+00:00,"Not to be weird but I think it being a Chinese virus figures in. Remember the Ebola scare? I think people have a different reaction to an ""invading foreign virus"" than the flu we get here every year."
CatherineYZ,2020-01-30 15:32:56+00:00,"As an Asian, I understand your feeling. These days some people even called the coronavirus as a Chinese Virus. Some places have a sign said they don’t welcome Chinese and Asian… your aunt’s reply is so nice! Good for her."
demendieta,2020-01-30 15:27:24+00:00,I suspect Budweiser name that Chinese virus 
MarkBrett11,2020-01-30 15:25:09+00:00,"A floating death trap, that's how nasty Chinese virus spreads in confined spaces, have a cracking cruise, I suffer from asthma and I'd never go on one of them, stay away from lurgy people "
NwsToday,2020-01-30 15:21:23+00:00, Coronavirus fuels XAU/USD demand Gold prices benefitted from rising concerns over a rapid spread of Chinese virus and Powell’s comments 
RepublickPontus,2020-01-30 15:17:50+00:00,@WhiteHouse @POTUS was the #ChineseVirus a #BiohazardWeapon which escaped their #Lab #CoverUp
panaynewsdotnet,2020-01-30 15:15:00+00:00,The United Arab Emirates on Wednesday confirmed the first cases in the Mideast of the new Chinese virus that causes flu-like symptoms. 
seorOConnor1,2020-01-30 15:14:44+00:00,United Airlines continues to contaminate other countries with the Chinese virus. Stop traveling to China @UnitedAirlines_
