user,created_at,text
qu_pos,2020-03-30 23:59:59+00:00,"#NationalDoctorsDay couldn't come at a better time to unite and recognize the incredible health care community. We know you’re putting in long hours, missing quality family time, and scrounging for supplies to fight #COVID19, and we thank you from the bottom of our hearts. "
GoReactforASL,2020-03-30 23:59:59+00:00,Health Workers Study #SignLanguage to Care for #Deaf COVID-19 Patients 
mclark1951,2020-03-30 23:59:59+00:00,Watch Freshman Dem Rep's COVID-19 Speech Devolve Into Unhinged Rant on House Floor 
NAT_ACCORD,2020-03-30 23:59:59+00:00,COVID-19 Update: Nigeria records 20 new cases as toll rises to 131 https://nationalaccordnewspaper.com/covid-19-update-nigeria-records-20-new-cases-as-toll-rises-to-131/
IburgHerold,2020-03-30 23:59:59+00:00,"#Covid_19 #COVID19 #GretaThunberg 's #VisionOfFuture for Earth. #FridaysForFuture #FridaysForHubraum All at home, no traveling, tons of toilet paper, no flights, no vacation, latrine, no internet. Welcome to #GretaLand"
mitchryals,2020-03-30 23:59:59+00:00,"DC announces 94 new positive cases of COVID-19, ranging in age from 9 to 93 years old, for a total of 495 people. No new deaths reported, according to @MayorBowser's news release this evening."
ArcStoneforNP,2020-03-30 23:59:59+00:00,When it comes to COVID 19- how do communicators help their organizations respond to the global health crisis? 
banalchemy,2020-03-30 23:59:59+00:00,#CNN stands for: Communist News Network #ChineseVirus #COVID19 #CommunistChina https://twitter.com/RealJamesWoods/status/1244740142079725569
CityHick92,2020-03-30 23:59:59+00:00,"Roses are Red, Violets are Blue Social Distancing is Scary But You Gotta Back It Up Put It In Reverse Terry #Covid19 #Bored #Quarantined"
openletterbot,2020-03-30 23:59:58+00:00," Support Donna by signing “Why You Must Act Now” and I’ll deliver a copy to your officials too: https://twitter.com/messages/compose?recipient_id=835740314006511618&amp;text=Covid%20Act Last delivered to @GovAbbott, Representative Hinojosa and Senator Watson #TXpolitics #COVID19 "
tksinclair,2020-03-30 23:59:58+00:00,Another doctor. New York neurosurgeon who separated conjoined twins dies from complications of Covid-19 - CNN 
LiziKernNews,2020-03-30 23:59:58+00:00,COVID 19 Peak in the Central Valley and United States is Still To Come. @KMJNOW
scstriebeck,2020-03-30 23:59:58+00:00,The real cure for coronavirus: Private research and innovation offer promising new leads. https://www.wsj.com/articles/the-real-cure-for-coronavirus-11585516011 via @WSJ Let the #markets work. #Ancap #justice @CNN @FoxNews #covid19 #coronavirus @US_FDA
ChicagoScience,2020-03-30 23:59:58+00:00,"How did PwC build a zip code level COVID19 model that takes age health status and icu capacity into account, along with mitigation measures? Don’t ask me! Listen to Sierra Hawthorne: "
televisionjam,2020-03-30 23:59:58+00:00,One patient released from isolation after recovering from COVID-19. #JACOVID19
General33626833,2020-03-30 23:59:58+00:00,Italian doctors demand protective supplies as #CoronaVirus deaths...At least 50 doctors have died from COVID-19 while trying to help the sick in Italy 
mcristian314,2020-03-30 23:59:58+00:00,"Aye, anyone have this covid-19 address, i just wanna talk "
openletterbot,2020-03-30 23:59:58+00:00," Support Kaylee by signing “Why You Must Act Now” and I’ll deliver a copy to your officials too: https://twitter.com/messages/compose?recipient_id=835740314006511618&amp;text=Covid%20Act Last delivered to @GovAbbott, Representative Stucky and Senator Fallon #TXpolitics #COVID19 "
pop_popculture,2020-03-30 23:59:57+00:00,holy shit @mta #covid19 RIP 
Debevoise,2020-03-30 23:59:57+00:00,Our M&A team asks: what’s the best way to negotiate agreements in this environment when no one can really know the full extent of the risk that COVID-19 represents? Here’s a few options. 
openletterbot,2020-03-30 23:59:56+00:00," Support Guadalupe by signing “Why You Must Act Now” and I’ll deliver a copy to your officials too: https://twitter.com/messages/compose?recipient_id=835740314006511618&amp;text=Covid%20Act Last delivered to @GovAbbott, Representative Gervin-Hawkins and Senator Menéndez #TXpolitics #COVID19 "
MROLDSCHOOL76,2020-03-30 23:59:56+00:00,1 thing 4sure everyone have in common right now>apart of history banning of big gatherings&gt;bars closed&gt;sporting events &amp; concerts cancelled&gt;casinos shut down&gt;A record 3.3 million Americans filed for unemployment benf as of today&gt; people dying by the thousands due to covid19
LiliVasileff,2020-03-30 23:59:56+00:00,Social Media with the Rapidly Spreading COVID-19 Read more at http://bit.ly/RapidlySpreadingCOVID-19 #lilivasileff #wealthprotectionmanagement
McgrottyJock,2020-03-30 23:59:56+00:00,The article from National Geographic is well worth reading in the context of COVID19. We would have been in a better position had the government acted sooner. Relying on ‘herd immunity’ was folly. Lessons from history were ignored. 
MattFromSMM,2020-03-30 23:59:56+00:00,Only good reason is that HCW’s are top priority and there aren’t enough. The other reasoning is silly and just shows WHO think people are dumb. It’s like telling someone not to wear a helmet cause they might not wear it properly and get a false sense of security. #COVID19 
hodgsonkr,2020-03-30 23:59:55+00:00,"How COVID-19 may change the way we look at pollution, climate change, e-commerce, restaurants, working remotely, our governments and our people by great London-based Canadian journalist @GwynneDyer."
ctvregina,2020-03-30 23:59:55+00:00,How a sidewalk artist is lifting spirits during physical distancing - https://regina.ctvnews.ca/how-a-sidewalk-artist-is-lifting-spirits-during-physical-distancing-1.4875064 #Sask #sk #yqr #COVID19 
drmakuni,2020-03-30 23:59:55+00:00,I must say: Merits where it’s due. I reckon this Job-Keeper package is one of the greatest initiatives an Australian government has implemented. It’s a beacon of light in so much darkness for so many #coronavirus #ScoMo #Covid_19 #auspol2020 #ausDiaries
stayhomesearch,2020-03-30 23:59:55+00:00,Coronavirus (#COVID19 ) Strikes #Airbnb Hosts: http://www.stayhomesearch.com/2020/03/30/coronavirus-covid-19-strikes-airbnb-hosts/
pgdailynews,2020-03-30 23:59:55+00:00,"Adrian Dix, Minister of Health, and Dr. Bonnie Henry, B.C.'s provincial health officer, have issued the following joint statement regarding updates on the novel coronavirus (COVID-19) response in British Columbia: #Coronavirus #cityofpg #northernbc http://pgdailynews.ca/index.php/2020/03/30/covid-19-eighty-six-new-cases-in-b-c-over-past-two-days-northern-health-area-now-has-14-cases/"
MarjiJSherman,2020-03-30 23:59:55+00:00,They look great! What a smart idea. I recently switched to gel manicure stickers. I'd love for you to share your perspective on life during #COVID19 on http://mycovidstory.org/submit.
robertupekk,2020-03-30 23:59:55+00:00,Positive covid-19
mjimen003,2020-03-30 23:59:54+00:00,@GovMurphy #COVID19 Good day sir out of the 72 hospitals why don't you guys used 60 and the other 12 for people that don't have coved19 to be able to go knowing they won't get sick of this I a few underline condición and I am afraid to go to any hospital if I get a asthma attack
BMBlammer,2020-03-30 23:59:54+00:00,7 niggas in Rialto already tested positive for COVID-19…yeah catch me outside next year 
markmattat,2020-03-30 23:59:54+00:00,"So if a person has the flu and other medical issues along with covid19, how are they reporting the cause of death? Died ""with"" covid19 or died ""of"" covid19? Also is the media ""accidentally"" changing ""with"" to ""of"" when reporting on the deaths?"
TusonWalters,2020-03-30 23:59:54+00:00,Since #Covid19 tore through Italy....I couldn't help but think DEEPLY about a former professor and friend. I messaged him via. IG. He responded to say he and his family are doing well. I was and still am excites to hear that.
mannyt_03,2020-03-30 23:59:53+00:00,Requested fed loan covid-19 forbearance on their website...for those with federal loans don’t forget to do this. 
salmirage,2020-03-30 23:59:53+00:00,There's now a 24hr channel that displays almost live stats on #covid19. USA has just passed France in number of deaths and will likely pass China within 12hrs. Some states/cities still don't have #StayAtHome orders!! #CoronaUpdates #CoronavirusOutbreak #
kal4554,2020-03-30 23:59:53+00:00,https://youtu.be/PUHrck2g7Ic Special message from Africa regarding prevention against #COVID-19
JakofAllTirades,2020-03-30 23:59:53+00:00,A president is supposed to force a company to make masks when others are volunteering? Are you high? #whosafacistnow #Coronavirustruth #DPA #COVID19 #coronavirus #ChinaLiedPeopleDied #ChinaVirus
imsooochi,2020-03-30 23:59:53+00:00,#AmazonStrike I’m an #AmazonPrime member and I am NOT spending another dime with #Amazon Until this #COVID19 is over. @JeffBezos is worth over $120 BILLION DOLLARS! He doesn’t need my money.
openletterbot,2020-03-30 23:59:53+00:00," Support Jared by signing “Why You Must Act Now” and I’ll deliver a copy to your officials too: https://twitter.com/messages/compose?recipient_id=835740314006511618&amp;text=Covid%20Act Last delivered to @GovParsonMO, Representative Roberts and Senator May #MOpolitics #COVID19 "
HellBoundReaper,2020-03-30 23:59:53+00:00,"I bet they never told you that Covid-19 is a disease from a virus called SARS-CoV-2..they keep calling it coronavirus or Covid-19, like AIDS is to HIV. They screamed AIDS AIDS AIDS..said it was a virus. lol"
schmarzo,2020-03-30 23:59:52+00:00,"Since the #COVID19 shelter-in-home mandate, the streets have gotten busier but are starting to look a little different... "
gvanantwerp,2020-03-30 23:59:52+00:00,Good article - Relax Pharmacy Regulations to help with COVID-19 Testing and Treatment https://www.mercatus.org/publications/covid-19-policy-brief-series/relax-pharmacy-regulations-help-covid-19-testing-and #FutureOfPharmacy #Rx
QUTAlumni,2020-03-30 23:59:52+00:00,"As a result of #COVID19 many of our students have lost their part-time and casual jobs. The @QUT Emergency Student Fund offers immediate support to eligible students. If you’re in a position to assist, please donate now: http://qut.edu.au/giving/emergency-fund #QUT #Covid_19australia"
madamyez,2020-03-30 23:59:52+00:00,Everyone should be wearing #gloves and a #mask whenever they go outside https://twitter.com/TheGlare_TM/status/1244757503809851393?s=19 #SpanishFlu #1918 #CoronaVirus #COVID19 
DIVINEMAKEOVER,2020-03-30 23:59:51+00:00,"Joe Diffie, Wry Country Traditionalist, Dead At 61 Following COVID-19 Diagnosis "
HeartofTARDIS,2020-03-30 23:59:51+00:00,"My patient flow has dramatically changed. Even with masks and gloves, MD and Admin want to limit the number of patients we see face to face. I believe a higher level of PPE is required when dealing with possible #COVID19 positive patients. #FrontLines #Nursing #Pandemic"
sandhu_jot19,2020-03-30 23:59:51+00:00,Everyone gonna die #ChineseVirus #Covid_19 #CoronaVirusUpdates #StayHome #StayStrong #Canada
SC_GrandCanyon,2020-03-30 23:59:51+00:00,Grand Canyon just announced its first case of COVID-19. People live in close quarters in the small community of Park Employees and Havasupai Tribal members and their families. Travel is difficult for many. Northern… https://www.instagram.com/p/B-YGgJNphBU/?igshid=t5qnxcps7uhb
TaranakiCD,2020-03-30 23:59:51+00:00,The daily COVID-19 press conference has been delayed by half an hour and will be live at 1:30pm.
cair_wa,2020-03-30 23:59:51+00:00,"THANK YOU to all the doctors, nurses, and health care workers on the front lines dedicating their time and well-being to take care of us during COVID19. We see you and appreciate all that you do! #NationalDoctorsDay2020"
LordPandaNYC,2020-03-30 23:59:51+00:00,"OK yesterday my Mother In Law lost a friend to Covid-19 and I have 2 family members in the hospital on respirators in NYC, one of them is a doctor. I haven't left the house in 3 weeks because my wife is recovering from surgery and she needs my care. Please everyone stay safe!"
chesty68,2020-03-30 23:59:51+00:00,"I had hoped our nation would begin to heal when we all faced a common enemy, as we did on 9/11. I thought we would unite when COVID-19 reared its ugly head, but I was wrong. The abyss that divides us is deeper and darker than ever, as our ""leaders"" fail to comfort and inspire."
AndrewWirski,2020-03-30 23:59:51+00:00,Congratulations on creating a situation where NSW has the highest covid 19 infections. 
CaliCali2000,2020-03-30 23:59:51+00:00,"Breaking: The US now has twice as many Coronavirus cases as China ever reached: 163,000+ versus 81,470 Per capita, the US outbreak is 8x China. So far ... #COVID19 #Coronavirustruth"
dougducey,2020-03-30 23:59:50+00:00,".@HealthSystemsAZ on “Stay Home, Stay Healthy, Stay Connected.” #COVID19 "
evolve_ag,2020-03-30 23:59:50+00:00,Spring on the farm means an abundance of fresh cheese! But with #covid19 a lot of dairy farmer business are being put at risk. Support your local farmers and buy fresh cheese! 
openletterbot,2020-03-30 23:59:50+00:00," Support Christina by signing “Why You Must Act Now” and I’ll deliver a copy to your officials too: https://twitter.com/messages/compose?recipient_id=835740314006511618&amp;text=Covid%20Act Last delivered to @GovAbbott, Representative Larson and Senator Campbell #TXpolitics #COVID19 "
nodoubtman,2020-03-30 23:59:50+00:00,COVID19 More than 800 doctors push back on April 1 pay changes Edmonton Journal
Countryman1885,2020-03-30 23:59:50+00:00,"Major grain bulk handlers, including WA’s Cooperative Bulk Handling, have taken the unusual step of publicly disclosing what stocks they have on hand to provide assurances to governments about the availability of grain in the midst of the COVID-19 crisis. "
britneysbandana,2020-03-30 23:59:50+00:00,@CollegeBoard . What are you doing in regards to CLEP exams??? #covid19
JoyceSchimenti,2020-03-30 23:59:50+00:00,"Sen Cotton, the World Health Organization requests that COVID19 not be referred to as the Chinese virus as it is inaccurate and stigmatizing. Asian Americans are being targeted as a result. Words matter. Arkansans need you to demonstrate leadership. #arpx"
AZSuzeQ,2020-03-30 23:59:49+00:00,"To say there isn't enough contact with Covid-19 contagions to warrant closing golf courses over fear of spread, is INSANE. But hey, if your gym closed, race right out to a golf course and get your exercise right now! Who will stop you?"
ELESmode,2020-03-30 23:59:49+00:00,Statistics across the world. Please #stayhome so we take control of this #COVID19 outbreak. Here are the statistics. Stay Alive. Keep your family and friends alive. #COVIDUG #coronavirus
Burning_Siren,2020-03-30 23:59:49+00:00,"I believe they also started this Covid19, correct?"
Tough_Muller,2020-03-30 23:59:49+00:00,these heros are all innocent as all Turkish people know. but they are in jails. release them on probation b4 COVID-19 comes. Meclis TahliyeDesin 
Marladukharan,2020-03-30 23:59:49+00:00,"Here are my thoughts on what’s likely to happen across the Caribbean economies for the remainder of this year, from a tourism and oil/gas standpoint, given the effects of #COVID19 https://marladukharan.com/wp-content/uploads/2020/03/MD-COVID19-Caribbean-Economic-Impacts.pdf"
bingeerrs,2020-03-30 23:59:49+00:00,In behalf of idiot stupid people discriminating our healthworkers thinking they are carrier of Covid-19. I AM SORRY . Soo disheartening receiving this treatment when you whole heartedly doing your job to save many people as you can.
UrsBolt,2020-03-30 23:59:49+00:00,#COVID19 tests #WealthManagement firms in 3 critical areas: Performance of #RoboAdvisors; #Wealth advisors' communication with customers; Importance of reliability and trust. @Forrester via @Forbes: https://www.forbes.com/sites/forrester/2020/03/30/covid-19-tests-wealth-management-firms-in-three-critical-areas/ #WealthTech #SocialDistancing
WizardOfAhhhs50,2020-03-30 23:59:49+00:00,100% AGREE!!!!!!!!!!!! #Coronavirustruth #COVID19 #coronavirus #CoronavirusUSA
colleen_farrell,2020-03-30 23:59:49+00:00,Healthcare workers are f-ing #HEROES. #WTF #coronavirus #COVIDー19 #COVID19. Shame on you @realDonaldTrump
cwalteroverman,2020-03-30 23:59:48+00:00,Happy Easter 2020 style. #COVID19 #covid19nc
SmurphLab,2020-03-30 23:59:48+00:00,People with Dependent care FSAs they can't use - I just found out by contacting my benefits company that COVID-19 counts as a qualifying event to change your deductions. Contact your HR to get a form to cancel/modify future payroll deductions so you don't lose any more money
erank9109,2020-03-30 23:59:48+00:00,All these restaurants switching to delivery in time of need and not one of them is ice cream delivery #QuarantineLife #COVID19
BS54613983,2020-03-30 23:59:48+00:00,Nothing changes #COVID19 
zulqarnain_86,2020-03-30 23:59:48+00:00,Covid-19 (Corona Virus Disease 2019) https://zoel2008.wordpress.com/2020/03/30/covid-19-corona-virus-disease-2019/
fanesakey_,2020-03-30 23:59:47+00:00,"Everyday feels like sunday~ sepi, sunyi.. I miss world without covid19 :("
ScienceAlert,2020-03-30 23:59:47+00:00,Here's Why You Don't Need to Freak Out About Cats Getting COVID-19 
deekevin56_m,2020-03-30 23:59:47+00:00,"Trump’s Monday comments showed he saw voter suppression as part of his re-election strategy, the Democratic National Committee (DNC) said in a statement Monday. “Ensuring that Americans can vote during the Covid-19 crisis is fundamental to maintaining our democracy."
OLADCGov,2020-03-30 23:59:46+00:00,As @MayorBowser said: We need everyone in our city to call a doctor or a health care provider if they have the symptoms of coronavirus-COVID-19. #StayHomeDC
joshua_zimm,2020-03-30 23:59:46+00:00,"Jane - this is pretty well debunked here: https://twitter.com/PirateOrg/status/1244598122682232832 Essentially, in a city of Wuhan's size (~20 mil) the usual number of ""deaths (not #covid19 related) over a ""normal"" 3-month period should be between 35,000 and 55,000""."
dbuis56,2020-03-30 23:59:46+00:00,Is Andrew Cuomo doing a great job in NY state? Is Trump helping them as he should be? #America #COVID19
Bowflex,2020-03-30 23:59:46+00:00,"Hey Shane - we are sorry about that! Due to the current COVID-19 situation, we are experiencing a drastic increase in incoming calls and emails. We are doing our best to handle the increased volume as quickly as we can, but there will be an extended delay in responses to emails."
cogscimom,2020-03-30 23:59:46+00:00,"Yesterday cogsci-child2 (5 yo), while writing and saying “sixteen” observed: hm, shouldn’t we say teen-6? Cogscimom: yes my sweet pea... we should. In our house, we resolved to call 16, onety-six #MTBoS #COVID19 #homeschool"
YourBlab,2020-03-30 23:59:46+00:00,I really am interested in knowing the factual origin of #COVID19 how did this come about? Over the next year or so will there be a solid answer? What exactly caused this to suddenly pop out?
focuscom,2020-03-30 23:59:46+00:00,Anyone else find it remarkable that it's only been a couple of weeks so far?? Seems like years... #COVID19
ejnyamogo,2020-03-30 23:59:45+00:00,Very hurting indeed that every passing second Precious life is lost out of #Covid19inSA #COVID19 is a global terrorist that has robbed mankind her best. I pray #vaccine is found very fast
AstrazenecaCAR,2020-03-30 23:59:45+00:00,The current economy will take measures that may affect you. Practice these 3 tips to prioritize financial spending and be able to benefit from your income. #FinancialHealth #COVID19 #TogetherWeAreBetter Information and adverse events: http://bit.ly/AdverseEventsAZ
CLEfanatic312,2020-03-30 23:59:45+00:00,"So there's national outcry on shortages of hospital masks. Pillow company says ""we will now make 50k/day"" by repurposing their facilities. Everyone on left loses their shit. At this point, is it safe to say they're hoping #COVID19 wins Democratic nomination?"
ijbrads66,2020-03-30 23:59:45+00:00,"In case you weren't sure what capitalism looks like, an obscene disgrace #COVID19 "
EP_Dr_Dolly,2020-03-30 23:59:44+00:00,"Renin–Angiotensin–Aldosterone System Inhibitors should be continued in patients in otherwise stable condition who are at risk for, being evaluated for, or with #COVID19 https://www.nejm.org/doi/full/10.1056/NEJMsr2005760?query=RP#.XoKHdHV8fWA.twitter #COVID19FOAM #FOAMed #FOAMcovid"
Fernanda_1DC,2020-03-30 23:59:44+00:00,My family and I have been #socialdistancing in the #UK for a month now. We started a good 2 weeks before they started getting serious here. It was obvious what the #COVID19 virus was doing. So anyone who says they didn’t know is lying to you
jonathankaskel,2020-03-30 23:59:44+00:00,@UFHealth hi. I can’t find the answer to this. Can you help? Is 3M Avagard-D hand antiseptic with moisturizer (61% w/w ethyl alcohol) effective hand sanitizer against Covid-19? Literature only mentions bacteria... https://www.3m.com/3M/en_US/company-us/all-3m-products/~/3M-Avagard-D-Instant-Hand-Antiseptic-with-Moisturizers-61-w-w-ethyl-alcohol-/?N=5002385+3293316360&amp;rt=rud
LeahGrey11,2020-03-30 23:59:44+00:00,"You are unsung heroes in the war against Covid-19, and very much under appreciated for all the great work you do to protect our country! Thank you! Most of us know your vital work in our protection and you are very worthy of our thanks. "
cannootropics,2020-03-30 23:59:44+00:00,"In COVID-19 fight, medical cannabis retailer eyes use of cannabinoids in clinical trial "
openletterbot,2020-03-30 23:59:44+00:00," Support Lauren by signing “Why You Must Act Now” and I’ll deliver a copy to your officials too: https://twitter.com/messages/compose?recipient_id=835740314006511618&amp;text=sign%20HAUKJZ Last delivered to @GovAbbott, Representative Neave and Senator Hall #TXpolitics #COVID19 "
DarlingBrandoFl,2020-03-30 23:59:43+00:00,"#Publixhero @Publix @PublixHelps #Publix at Publix my hero is Jacob Brandenburg. Store #879 bc of #COVID19 #coronavirus Jacob goes above &amp; beyond. He works long hours. Ready to help everyone. can’t fine something he shows me. Talks to kids, elderly like there his family."
marcuspradel,2020-03-30 23:59:43+00:00,"Globalist Socialists good, orange man bad. There, saved you 10,000 words. And a NYT subscription."
zareeeeef,2020-03-30 23:59:43+00:00,"What's crazy... without COVID19, we would have hit a recession VERY soon anyway. Absolutely no way would the public be okay with corporations getting bailed out again while everyone suffers from their wrongdoings. We were so close to one of the biggest movements ever seen "
tharfagreinir,2020-03-30 23:59:43+00:00,COVID-19 has now killed thousands and you are now implying that keeping it at a hundred thousand would be a win. Still feel like a big guy next to Obama? Still think you're the best? Still feel you have it all under control?
warvan24_8,2020-03-30 23:59:43+00:00,"Hi I want to share my theory about covid-19.This started in it’s a new virus so they don’t know all the information about it but if you look at the charts total cases:81,470 total recovere:75,700 also 1 billion people live in yet Italy has higher death brought covid-19 "
beingrichard,2020-03-30 23:59:42+00:00,Only #disinfo comes from US (e.g Trump-ian nonsense like malaria pills cure #Covid19) and UK (dangerous #Johnson nonsense about #herdimmunity [see link]). #China has provided scientific/medical stats to all. #Russia gives aid to #Italy. #NATO irrelevant. https://www.dailymaverick.co.za/article/2020-03-30-coronavirus-fake-news-how-the-british-government-misled-the-public-for-weeks/?utm_content=buffer5c8f0&amp;utm_medium=social&amp;utm_source=twitter.com&amp;utm_campaign=buffer
lazaroumterror,2020-03-30 23:59:42+00:00,"This is what being abandoned by your national government looks like, it'll be happening here too, why wouldn't it? #COVID19 "
BobWilsonWTNH8,2020-03-30 23:59:42+00:00,https://bit.ly/2Uv9c2N Hospitals in Connecticut are teaming up to help combat COVID-19 and make sure everyone gets the treatments they need. Full story on http://WTNH.com
jmmeader,2020-03-30 23:59:42+00:00,But in the US...all elective medical procedures have been suspended due COVID-19. Now that little girl impregnated by her uncle gets to carry that nightmare that much longer....PRAISE JESUS THAT HER TORTURE CONTINUES!! 
GovLeaseAdvisor,2020-03-30 23:59:42+00:00,Managing Federal Contract Performance Issues Associated with the Novel Coronavims (COVID-19) https://www.acquisition.gov/sites/default/files/page_file_uploads/M-20-18.pdf
rullsy,2020-03-30 23:59:41+00:00,Stop this obscenity! #wuhan #covid19 #wetmarket &gt;
Resister19681,2020-03-30 23:59:41+00:00,"A suspect in Midland, TX stabbed a 2 yr old & 6 yr old because he thought they were Chinese & spreading Coronavirus. Tell me again how @realDonaldTrump calling it the #ChineseVirus isn't racist! #UnfitToBePresident #COVID19 #RacistInChief"
openletterbot,2020-03-30 23:59:41+00:00," Support CarolynRhea by signing “Why You Must Act Now” and I’ll deliver a copy to your officials too: https://twitter.com/messages/compose?recipient_id=835740314006511618&amp;text=Covid%20Act Last delivered to @GovAbbott, Representative Moody and Senator Rodríguez #TXpolitics #COVID19 "
AlnwickKeith,2020-03-30 23:59:41+00:00,Who can blame them. Would WE risk the lives of ourselves and our families? Wrong for Canada to expect our health care workers to do that. #covid19 #pandemic #GetOnTheRightSideOfHistory #CanadaCovid19
