user,created_at,text
SbonnerABV,2020-03-30 23:58:53+00:00,Great to see Kim Prints having local artists paint their window protection panels with our hero Canadian health officials #COVID19 #CanadaCovid19
flexjobs,2020-03-30 23:58:53+00:00,"“While the significant spike in #unemployment claims is expected to rise, #remotework offers opportunities to stay safe while still growing your career, regardless of your situation.” #wfh #workfromhome #workfromhomejobs #jobsearch #remotejobs #covid19 "
ProphetiMage,2020-03-30 23:58:53+00:00,Depends on the situation... If it is a woman ( like earlier) .. is down her luck... And WAS working ..and now she can't because of this Covid-19 virus ... Then that is NOT her fault ..and what if she has a kid?... Are you going to throw her AND her kid out on the street?.. NO!
EULaws,2020-03-30 23:58:53+00:00,Germany Makes Substantive Amendments to Insolvency Act Amid COVID-19 
BerimVega,2020-03-30 23:58:53+00:00,#Hungary's new #Covid_19 emergency law passes @AmnestyNZ
RjNotRajay,2020-03-30 23:58:53+00:00,Idk bout you guys but ive had like 2 panic attacks and 3 crying spells about Covid19
JamaicaGleaner,2020-03-30 23:58:53+00:00,"Health Minister @christufton reports that 'Patient 5' has now recovered and was last night released from hospital. The patient, who is from St Ann, reported an onset of the #COVID19 symptoms on March 3, according to @themohwgovjm."
BrownsteinHyatt,2020-03-30 23:58:53+00:00,Tune in to hear our team discuss how the government's response to COVID-19 is impacting Nevada businesses. | https://bit.ly/39u00Qw
FaegreDrinker,2020-03-30 23:58:53+00:00,"The FDA Center for Devices and Radiological Health has issued guidance meant to expand the availability of non-invasive remote patient monitoring devices, in an effort to reduce patient and healthcare provider contact and exposure to COVID-19. Learn more. https://bit.ly/2WUr60B"
almaramirez69,2020-03-30 23:58:52+00:00,Keeping busy with home arts and crafts. #NiemesElementarySchool #COVID19 #StayHome
openletterbot,2020-03-30 23:58:52+00:00," Support Immanuelle by signing “Why You Must Act Now” and I’ll deliver a copy to your officials too: https://twitter.com/messages/compose?recipient_id=835740314006511618&amp;text=Covid%20Act Last delivered to @GovAbbott, Representative Vo and Senator Huffman #TXpolitics #COVID19 "
openletterbot,2020-03-30 23:58:52+00:00," Support Chris by signing “Why You Must Act Now” and I’ll deliver a copy to your officials too: https://twitter.com/messages/compose?recipient_id=835740314006511618&amp;text=Covid%20Act Last delivered to @GovAbbott, Representative Canales and Senator Hinojosa #TXpolitics #COVID19 "
MikeRPlaisance,2020-03-30 23:58:52+00:00,"Coronavirus: Holyoke Soldiers’ Home superintendent placed on leave, at least 5 residents die from COVID-19 — By Jeanette Deforge "
KevinCTofel,2020-03-30 23:58:52+00:00,"Journaling 500 or so words a day during the #COVID19 pandemic for my upcoming post-apocalyptic thriller. Now that I’m out of liquor and the PA stores are closed, I think I came up with the brooding title and cover shot for my novel: “The Last Manhattan” "
jenniferlovex0,2020-03-30 23:58:52+00:00,Seasonal depression SZN was ending and then COVID-19 happens and here we are...
Spoonerpuck,2020-03-30 23:58:51+00:00,@realDonaldTrump @VP @SteveFDA @CDCDirector @SecAzar Testing delays continue to cost lives #deathsquad5 #TestingForCovid19 #COVID19 #COVIDTESTINGNOW
JDawsonTweets,2020-03-30 23:58:51+00:00,"Daddy-Daughter’ Viral Duets Aim to Bring #Hope, Joy Amid #COVID-19 Despair: The Prayer"
theScarberry,2020-03-30 23:58:51+00:00,No stream tonight. I'm really sorry. My chest hurts so much worse today. I'm gonna call my doctor tomorrow and see if I'm even eligible for a COVID-19 test. I am scared. Stay home.
MrBarltrop,2020-03-30 23:58:51+00:00,Collaboration will be difficult between colleagues in this fully online #elearning brought about by #covid19. I suggest making departmental #WhatsApp groups to help keep the conversation flowing. Informal chats with a mix of focus support growth. #onted #tdsbudl #edchat
KFNdisplay,2020-03-30 23:58:51+00:00,"Klamath County has a new confirmed case of COVID-19. 5 total cases in the county - 4 active, 1 recovered."
openletterbot,2020-03-30 23:58:50+00:00," Support Kim by signing “Why You Must Act Now” and I’ll deliver a copy to your officials too: https://twitter.com/messages/compose?recipient_id=835740314006511618&amp;text=Covid%20Act Last delivered to @GovAbbott, Representative Smithee and Senator Seliger #TXpolitics #COVID19 "
CityEastvaleCA,2020-03-30 23:58:50+00:00,"3/30/2020 Update: The Riverside University Health System has confirmed 16 cases of COVID-19 in the City of Eastvale. For more information, please visit: https://www.rivcoph.org/coronavirus"
NatlASCBilling,2020-03-30 23:58:50+00:00,Ambulatory Surgery Centers can now temporarily enroll as hospitals under sweeping regulatory changes announced by CMS in the White House Covid-19 Task Force. #CMS #surgerycenters
openletterbot,2020-03-30 23:58:50+00:00," Support Chris by signing “Why You Must Act Now” and I’ll deliver a copy to your officials too: https://twitter.com/messages/compose?recipient_id=835740314006511618&amp;text=Covid%20Act Last delivered to @GovAbbott, Representative Phelan and Senator Creighton #TXpolitics #COVID19 "
LocalTalkNewark,2020-03-30 23:58:50+00:00,Introducing... Local Talk Day By Day Online Edition - https://mailchi.mp/2b29665b7a80/introducing-local-talk-day-by-day-online-edition-2553722 #coronavirus #covid19 #LTDayXDay #newark #newjersey #pandemic #stayhome
_Lisahiraa,2020-03-30 23:58:50+00:00,"Yaaall, that COVID-19 test, is PAINFULL ASF! It burns so bad and they goo deeeep in yo damn nostril"
politstrip,2020-03-30 23:58:50+00:00,I have been hearing reports from across the country and particularly in New York from healthcare workers that they have been told to classify that as COVID-19 even if they are not.
dtsurreybia,2020-03-30 23:58:49+00:00,"Important Survey - Let us know how COVID-19 is impacting your business. Surrey Restaurant Business Impact Survey &amp; Survey for retail, hospitality, industrial, &amp; professional services "
tedrosTesfamar1,2020-03-30 23:58:49+00:00,How long can the virus that causes COVID-19 live on surfaces? https://bit.ly/3dg00XB via @HubJHU
vogcinreds,2020-03-30 23:58:49+00:00,Have to wonder if car 19 has covid-19 
Zee_Abdi,2020-03-30 23:58:48+00:00,"Unlike the exaggeration of the prophets of doom, it’s likely our warmer climate, youthfulness of our nation, strong faith in Allah and ensuring havin enough traditional medicine (xabasuud iyo macsaradi) will all minimise the impact of #COVID19. Also, just #WashYourHands #Somalia"
DonboscoU,2020-03-30 23:58:48+00:00,I am now an #MBRUCommunityImmunity Ambassador. I am responsible to protect myself and my community from #COVID-19. I challenge @macro488 and You to take the course. 
nicdhana,2020-03-30 23:58:48+00:00,"""Every elder in our communities holds a degree of our collective wisdom, history, and teachings that guide our governments, ceremonies, and societies."" ""For #Indigenous communities, though, losing one elder means losing a significant part of our culture."" #COVID19 #Elders"
paulbetty2,2020-03-30 23:58:48+00:00,That comfort food...PUFF PUFF amid #COVID-19
mikehewritesit,2020-03-30 23:58:47+00:00,"It's time to be a leader, not a follower, @GovBillLee. A toothless, barely-enforced Safer at Home order rife with exceptions for non-essential things like large groups continuing to gather at churches unnecessarily risks the lives of Tennesseans. #StayAtHome #OrderItNow #COVID19 "
openletterbot,2020-03-30 23:58:47+00:00," Support Esther by signing “Why You Must Act Now” and I’ll deliver a copy to your officials too: https://twitter.com/messages/compose?recipient_id=835740314006511618&amp;text=Covid%20Act Last delivered to @GovAbbott, Representative Cortez and Senator Flores #TXpolitics #COVID19 "
EmilioIAlarcon1,2020-03-30 23:58:47+00:00,Kids do not realize #COVID19 self- isolation is preparing them for the trip to #Mars! Btw my throat is feeling funny and I had to use my inhaler twice today! Self-isolated for the next 14 days... #AcademicChatter
irishurricane,2020-03-30 23:58:47+00:00,"Frontline NY Nurses Lack Protective Masks & Ventilators, Say Worst Yet to Come as COVID-19 Spreads https://www.democracynow.org/2020/3/25/frontline_healthcare_workers_ppe_shortage_coronavirus via @democracynow"
BKomia,2020-03-30 23:58:47+00:00,As you social distance and quarantine laughter can change bring relief. But remember to #fightcoronavirus #covid_19 #stayhome #quarantine https://www.instagram.com/p/B-YIdgUBGoP/?igshid=1ghjivu28bmx
atbaypress,2020-03-30 23:58:47+00:00,Emergency funding to Canadian writers facing lost income because of the global COVID-19 pandemic: 
BAmeenoo01,2020-03-30 23:58:46+00:00,"Husband Was Checking His Wife's Phone And Saw A Contact Named Covid19, He Called The Number And His Own Phone Rang. "
llborio,2020-03-30 23:58:46+00:00,My oped @WSJopinion with @garcher101 executive director of the National Fusion Center Association &amp; former @WHNSC colleague Joel Cohen (former NSC director for law enforcement) on deploying technology to help with #COVID19 public health measures while protecting privacy. 
DilawarAdvocate,2020-03-30 23:58:46+00:00,Tiger Force? Any NRO? #COVID19 @MaryamNSharif @CMShehbaz @betterpakistan @Shahidmasooddr @ImranKhanPTI @shazbkhanzdaGEO @fawadchaudhry @HamidMirPAK @BBhuttoZardari @KMSMQM
UglyMuchachoo,2020-03-30 23:58:46+00:00,what indoor programs would train my biceps and triceps mate... covid 19 got me locked
jobcoachusa,2020-03-30 23:58:46+00:00,Daily Situation Report #70 from WHO #COVID-19. Italy and Spain combined account for more than half of the new deaths worldwide. Attachment shared for Healthcare impacts locally https://lnkd.in/gVvh-hq
lawhawk,2020-03-30 23:58:46+00:00,The death toll from covid19 in the US now exceeds 800 Benghazis. Remember when the GOP were concerned and required incessant and nonstop hearings about Benghazi? 4 Americans dead and they were concerned. 3200+ Americans dead and now they shrug it off.
PtiranipurSindh,2020-03-30 23:58:46+00:00,Account Title Prime Minister's Relief Fund for COVID-19 National Bank of Pakistan Account No. 4162786786 Swift code : NBPAPKKAMBR NBP Main Branch Karachi
nannugent,2020-03-30 23:58:45+00:00,@Nigel_Farage keep on speaking out about holding CCP accountable Nigel! They caused this pandemic! Now they want to swoop in &amp; save the ? Hell to the NO! on hands! They are harvesting double lung transplants from political prisoners to sell on black market to Covid19 ppl.
AnaMartinsGomes,2020-03-30 23:58:45+00:00,"3 border guards accused of killing Ukrainian citizen were sent into house arrest bcs of #covid19. A shocking contrast with @RuiPinto_FL, the whistleblower of #footballleaks &amp; #luandaleaks, who stays in preventative prison over 1 year, accused of attempted extortion. Outrageous!!!"
Eugenia_South,2020-03-30 23:58:45+00:00,"In a post #COVID19 world, Emergency Medicine will finally be a field highly respected by all of medicine. There aren’t many who can do what we are doing right now . . . ."
changelingchil1,2020-03-30 23:58:45+00:00,Your preferences are at odds with reality. Australia's economy was already in the doldrums before covid-19 but let's not pretend the government has what it takes to avert what most countries will have to weather.
ZazaFL,2020-03-30 23:58:44+00:00,#FreeThemAll4PublicHealth #NoWaytoTreataChild Israeli authorities must release all Palestinian child detainees amid COVID-19 pandemic #nowaytotreatachild
DavidAllenSD,2020-03-30 23:58:44+00:00,"Coronavirus Update (Live): 784,006 Cases and 37,778 Deaths from COVID-19 Virus Outbreak - Worldometer https://www.worldometers.info/coronavirus/"
michelle_lodl,2020-03-30 23:58:44+00:00,The news is always changing with the COVID-19 outbreak. Check back to our Coronavirus Resources page to stay up-to-date on the latest news. 
HawleysJadefav,2020-03-30 23:58:44+00:00,Mark Cuban says President Donald Trump should get ‘all the credit in the world’ for handling COVID-19 pandemic - TheBlaze 
arabikabara,2020-03-30 23:58:43+00:00,"Northen region we have no covid 19 testing centre and how can identify infection person' at once president endorse 10 billions naira for lagos state lastly others states needs to build covid 19 testing centre for the safe of our states and nation wide,"
openletterbot,2020-03-30 23:58:43+00:00," Support Joy by signing “Why You Must Act Now” and I’ll deliver a copy to your officials too: https://twitter.com/messages/compose?recipient_id=835740314006511618&amp;text=sign%20haukjz Last delivered to @GovAbbott, Representative Stickland and Senator Powell #TXpolitics #COVID19 "
openletterbot,2020-03-30 23:58:43+00:00," Support Kari by signing “Why You Must Act Now” and I’ll deliver a copy to your officials too: https://twitter.com/messages/compose?recipient_id=835740314006511618&amp;text=Covid%20Act Last delivered to @GovAbbott, Senator Schwertner and Representative Bucy #TXpolitics #COVID19 "
mathieuvo,2020-03-30 23:58:43+00:00,"Hey @NYCMayorsOffice @NYCMayor, I would love to come spend my money in NYC... I’m sure yur economy will need it after this #COVID19 crisis... but for that, they need a marriage license... allezzzzzzzz s’il vous plaittttttttt."
AmberMcIntosh07,2020-03-30 23:58:43+00:00,Thanks @NatGeoMag just the extra scoop of depression I needed during the quarantine. #COVID19 #Quarantine
DrSamirSinha,2020-03-30 23:58:43+00:00,"$10M THANK YOU$! Thanks @DrFullertonMPP +@RaymondChoPC for funding extra support for Ontario's Seniors from community agencies, businesses and volunteers + to help also combat social isolation as we do our best to protect them from #COVID-19. Learn more:"
openletterbot,2020-03-30 23:58:43+00:00," Support Lauren by signing “Why You Must Act Now” and I’ll deliver a copy to your officials too: https://twitter.com/messages/compose?recipient_id=835740314006511618&amp;text=Covid%20Act Last delivered to @GovAbbott, Senator Buckingham and Representative Goodwin #TXpolitics #COVID19 "
GemiahR,2020-03-30 23:58:43+00:00,Covid 19 
navy30vet,2020-03-30 23:58:42+00:00,How isn't @NYGovCuomo like a handkerchief in a slumlord's suit to be used to blow #CoronaVirus &amp; #Covid19 from its nose? @danarubinstein @nathantempey @alykatzz @melissadderosa @RichAzzopardi @bradhoylman @SenGianaris
ElectBlocker,2020-03-30 23:58:42+00:00,"This #MentionMonday I'd like to acknowledge all those who are working to keep things going during this difficult time. My hope is that we all strive to be courteous and patient with one another during COVID-19 and beyond. If you are able, thank an essential worker today! "
WePurifai,2020-03-30 23:58:42+00:00,"It’s tough to get rid of cigarette #smells, but an #ozone treatment can do it. It's also used to kill germs and bacteria #Corona #COVID19 #COVID #COVID2019 #Covid19inSA #Coronavirustruth #CoronaVirusUpdate #CoronaUpdate #CoronavirusOutbreak #COVIDー19"
PDBiz33,2020-03-30 23:58:42+00:00,"COVID-19 Vaccine has been under our kitchen sinks and noses all along. Members of the WHO, Townsend and Daltrey confirm Tide PODS are the reason Millennials and Generation Zs are 30 times less likely to die from the virus. "
openletterbot,2020-03-30 23:58:42+00:00," Support Travis by signing “Why You Must Act Now” and I’ll deliver a copy to your officials too: https://twitter.com/messages/compose?recipient_id=835740314006511618&amp;text=Covid%20Act Last delivered to @GovAbbott, Representative Lang and Senator Birdwell #TXpolitics #COVID19 "
KTREnews,2020-03-30 23:58:42+00:00,Angelina College commencement cancelled due to COVID-19 concerns https://www.ktre.com/2020/03/30/angelina-college-commencement-cancelled-due-covid-concerns/
mikaxxxxxxxxx,2020-03-30 23:58:42+00:00,"NEWS: #YOSHIKI DONATES $100,000 TO #COVID19 RELIEF FUND FOR #MUSIC INDUSTRY DEVASTATED BY CORONAVIRUS OUTBREAK #yfa https://www.yoshikifoundationamerica.org #grammy https://www.grammy.com/musicares/get-help/musicares-coronavirus-relief-fund"
AreYouEdutained,2020-03-30 23:58:42+00:00,This is hilarious... #funnymemes #QuarantineAndChill #COVID19 
openletterbot,2020-03-30 23:58:41+00:00," Support Shawn by signing “Why You Must Act Now” and I’ll deliver a copy to your officials too: https://twitter.com/messages/compose?recipient_id=835740314006511618&amp;text=Covid%20Act Last delivered to @GovAbbott, Senator Schwertner and Representative Bucy #TXpolitics #COVID19 "
openletterbot,2020-03-30 23:58:41+00:00," Support Scott by signing “Why You Must Act Now” and I’ll deliver a copy to your officials too: https://twitter.com/messages/compose?recipient_id=835740314006511618&amp;text=Covid%20Act Last delivered to @GovParsonMO, Representative Allred and Senator Luetkemeyer #MOpolitics #COVID19 "
RenanJulian,2020-03-30 23:58:41+00:00,After Hours: Dr. Eric Cole https://youtu.be/tFKOdtUdWec via @YouTube Something to be Cautious About at time of Covid-19#
openletterbot,2020-03-30 23:58:41+00:00," Support Caleb by signing “Why You Must Act Now” and I’ll deliver a copy to your officials too: https://twitter.com/messages/compose?recipient_id=835740314006511618&amp;text=Covid%20Act Last delivered to @GovAbbott, Senator Campbell and Representative Zwiener #TXpolitics #COVID19 "
paulvhayes,2020-03-30 23:58:41+00:00,"AP:""2 days after the lawsuit was filed 11Mar2020, the defendants issued a press release announcing that they were developing tests for COVID-19. Labrador had no prior knowledge &amp; promptly wrote to the defendants offering to grant them a royalty-free license for such tests."" "
BadgleyLaurence,2020-03-30 23:58:41+00:00,"If antigen surge is COVID-19 viral residues presented to T-cells, a cytotoxic storm (including IL-2, IL-7, IFN-gamma, TNF-aloha) ensues. (Ref: Mehta, P. “COVID-19: consider cytokine storm syndrome &amp; immunosuppression”. Lancet, 3/16/20; http://doi.org/10.1016/50140-6736(20)30628-0"
Physns1stWatch,2020-03-30 23:58:41+00:00,Your @NEJMGroup Today: #COVID19 Care Delivery Plan Gabapentin &amp; #AlcoholUseDisorder Onc/Hem &amp; ID Opportunities https://jwat.ch/2UvoJQs
tonywyman21,2020-03-30 23:58:41+00:00,My latest at National Compass. Trump lied when he claimed he was blindsided by COVID-19. His own administration warned him a virus coming into the U.S. could run hospitalize 7.7 million and kill the equivalent of 195x the 9/11 terrorist attacks. 
sandyryanpopp,2020-03-30 23:58:41+00:00,"""Don't get too close, don't touch, don't breathe the same air"" sounds like #coronavirus warnings, but it's not. I love this! https://youtu.be/VL8DThllZAY #COVID19 Watch episode 1 of @thechosentv now it's free. Episode 2 airs tonight."
BluewaveBiden,2020-03-30 23:58:40+00:00,New Jersey National Guard soldier dies of COVID-19 | FOX 29 News Philadelphia 
MickRandallHS,2020-03-30 23:58:40+00:00,Just clocked #Covid_19 #Isolation
ValaHomeImprove,2020-03-30 23:58:40+00:00,"When your exhausted wife who has been working 7 days a week on Pandemic planning texts you from her bed asking for a few BBQ peanuts, you happily get up and bring her some. Thankfull for all her work and so many others. #COVID19"
onemedical,2020-03-30 23:58:40+00:00,The thought of staying home #30moredays may seem overwhelming — but it doesn't have to be. Take a moment to feel rooted amongst the chaos with this guided meditation with Wellness Coach Shawn Casey: http://ms.spr.ly/6015TeybR #COVID19 #flattenthecurve
StarnelRichon,2020-03-30 23:58:40+00:00,I don't understand how anyone thinks a $1200 check one to three weeks from now is going to come even close to fixing this. #COVID19
openletterbot,2020-03-30 23:58:40+00:00," Support Sarah by signing “Why You Must Act Now” and I’ll deliver a copy to your officials too: https://twitter.com/messages/compose?recipient_id=835740314006511618&amp;text=Covid%20Act Last delivered to @GovAbbott, Representative Israel and Senator Watson #TXpolitics #COVID19 "
xisquared,2020-03-30 23:58:40+00:00,day 18 of #SocialDistancing: work today felt productive yet unproductive at the same time. it was weird. tried having black tea this morning. still too much caffeine for me i think in other news my @senreve bag came today! #COVID19 
justbeingaj,2020-03-30 23:58:39+00:00,Calling all entrepreneurs or soon to be #entrepreneurs check out the @FoundedCo #virtual #learning series that will give you tips &amp; info on building and maintaining a business during #COVID19. #founded #entreprenurlife @Shes4Sports
679Billy,2020-03-30 23:58:39+00:00,"COVID 19 spreads, everyone dies n i dont spread my seed in Kadavu n Nadroga, we loose the 4 legged animals. -Everyone kusimas the Toas #tuloutauvu "
pammyxjean,2020-03-30 23:58:38+00:00,"60-90 year olds still walking around being exposed to covid19 and no one thinks we need a mandatory quarantine of all non essentials. With curfew and military presence? Those people will be DEAD, DEAD of nothing is done. @dougducey @CDCgov"
ANCALERTS,2020-03-30 23:58:38+00:00,"Nograles: But we have to set up a 'new normal.' While wala pa tayong vaccine, we have to practice social distancing. #COVID19 #LuzonLockdown"
ChasGunaratne,2020-03-30 23:58:38+00:00,"Solo ride #2 completed at 22 degree heat. . . . . . . . . . . . . . #cycling #pinarello #roadbike #nz #lockdown #auckland #covid19 #coronavirus #chasgunaratne @Auckland, New Zealand https://www.instagram.com/p/B-YIdoFpj7R/?igshid=ekrp4xbqq5tx"
brooklynsalt,2020-03-30 23:58:38+00:00,"Wishing, @vgcerf, the father of the Internet a speedy recovery. Given his stature and background, I would as advise everyone to view @iamjohnoliver’s response to the #COVID19 health crisis "
MJCappraiser,2020-03-30 23:58:38+00:00,Whine Whine Whine is that all you can do. You have been handling this covid 19 pretty well and getting the equipment we need since you screwed up buying the ventilators we needed to invest in a solar farm that folded
DragoonScene,2020-03-30 23:58:37+00:00,I should add that the kicker to this irony is that POC will absolutely comprise a disproportionate share of COVID-19 deaths.
AsaHutchinson,2020-03-30 23:58:37+00:00,"On #NationalDoctorsDay, I commend the extraordinary physicians who protect &amp; heal daily. We are especially grateful for your sacrifice during the COVID-19 outbreak. This year, we can support our doctors by social distancing while they save lives during this crisis."
jonathankaskel,2020-03-30 23:58:37+00:00,@UTHealthcareSA hi. I can’t find the answer to this. Can you help? Is 3M Avagard-D hand antiseptic with moisturizer (61% w/w ethyl alcohol) effective hand sanitizer against Covid-19? Literature only mentions bacteria... https://www.3m.com/3M/en_US/company-us/all-3m-products/~/3M-Avagard-D-Instant-Hand-Antiseptic-with-Moisturizers-61-w-w-ethyl-alcohol-/?N=5002385+3293316360&amp;rt=rud
shishi__mato,2020-03-30 23:58:36+00:00,Dont donate to Covid-19 relief only rich people
pakindc,2020-03-30 23:58:36+00:00,"at least now we know what she will fight for. Not food stamps, not universal coverage for COVID-19 expenses, not higher wages for health care workers. But when it comes to lower taxes for high six figure earners - she will fight!"
JustSayingTrump,2020-03-30 23:58:36+00:00,Chinatown? This racist b itch! #USA #America #COVID19
elttesitram,2020-03-30 23:58:36+00:00,"Coronavirus has now killed more Americans than the terrorist attacks in September, 2001. Maybe it's time for an overreaction. #COVID19"
openletterbot,2020-03-30 23:58:36+00:00," Support Emily by signing “Why You Must Act Now” and I’ll deliver a copy to your officials too: https://twitter.com/messages/compose?recipient_id=835740314006511618&amp;text=Covid%20Act Last delivered to @GovAbbott, Representative Schaefer and Senator Hughes #TXpolitics #COVID19 "
JoesCorner76,2020-03-30 23:58:36+00:00,Good advice for the times. #Covid19 #selfisolate #Canada #believe #hope #joescorner76
RussPran,2020-03-30 23:58:36+00:00,Ken Ham Responds to COVID-19 from a Christian Worldview Perspective https://youtu.be/lM_pM9ZP9GA via @YouTube
English_AS,2020-03-30 23:58:35+00:00,Video: Tears of a doctor unable to hug his son #coronavirus #covid19 
barbara_volkwyn,2020-03-30 23:58:35+00:00,South African crackdown amid #coronavirus #lockdown called into question as some ignore restrictions https://www.foxnews.com/world/south-african-crackdown-amid-coronavirus-lockdown-called-into-question-workers-defy-restrictions #Coronavirus #CoronavirusSouthAfrica #CoronavirusSA #CoronavirusInSA #coronavirusafrica #Covid_19 #Covid19SA #COVID19 #LockdownSA
GataFrida,2020-03-30 23:58:35+00:00,@netanyahu I never asked you anything. Call your friend @bolsonaro and talk about #COVID19 please. He hears you.
WalkInVerse,2020-03-30 23:58:35+00:00,"All you in lockdown, this was NOT done by Trump. This is done by your GOVERNORS! The GOVERNORS are removing your rights. It's unconstitutional. Trump ordered title 10, not 32. This leaves it in the hand's governors. Look at what states are locking down? Remember. #COVID19"
JatnielMunoz,2020-03-30 23:58:34+00:00,"""Pain is temporary. It may last a minute, or an hour, or a day, or even a, but eventually it will subside and something else will take its place. If I quit, however, it lasts forever"" #coronavirus #COVID19"
earthprairie,2020-03-30 23:58:34+00:00,"Alberta testing for #covid19 delayed only 175 tests by 03/06. After first #covid19ab cases reported in #yyc #yeg testing increased rapidly - now 44,999 tests on 03/27 - but may not be enough to contain spread science-based experts warn. #abhealth #abpoli @CBCFletch"
